Hej!;Hej!;Hej!;Hej?
Verjemite mi, s tem se bavim.;Verjemite mi, s tem se ukvarjam.;To nima veze z mano.;No, pa saj veste o čem govorim.
Nekaj skriva in ugotoviti moramo kaj to je.;Nekaj skriva in ugotoviti moramo kaj to je.;To pomeni, da ga moram najti.;Vstopili bomo v njegovo podzavest in ugotovili, kaj vem je hotel prikriti.
Hočem, da isto, kar je nameraval storil vam, vi storite njemu.;Hočem, da tisto, kar je nameraval storil vam, vi storite njemu.;Hočem, da se odloči deliti očetov imperij.;Če opravim... če sploh lahko storim, hočem zagotovilo.
Vstopili bomo v njegovo podzavest in ugotovili, kaj vem je hotel prikriti.;Vstopili bomo v njegovo podzavest in ugotovili, kaj vem je hotel prikriti.;Ko prodremo v njegov um, bomo morali postopati s tem, kar najdemo.;Ubijanje ga bo pač le prebudilo.
V redu.;V redu.;V redu.;V redu.
Spi.;Spi.;Ve.;Mene.
Moment, v čigavo podzavest pravzaprav gremo?;Trenutek, v čigavo podzavest pravzaprav gremo?;Je tole čutiti resnično?;Bi rekel svoji podzavesti, naj se malo kontrolira?
V Fischerjovo, a sem mu rekel, da je Browningova, da bo lahko član naše ekipe.;V Fischerjevo, a sem mu rekel, da je Browningova, da bo lahko član naše ekipe.;Tveganje ni bilo mišljeno, saj nisem vedel, da bomo imeli opravka s streljanjem.;Ustvarila sem spodnje nadstropje bolnice, da Fischer privede svojega očeta.
Pomagal nam bo vlomiti v svojo lastno podzavest.;Pomagal nam bo vlomiti v svojo lastno podzavest.;Ko se prebudi, bo povsem brez uma.;Vstopili bomo v njegovo podzavest in ugotovili, kaj vem je hotel prikriti.
-Tako je.;-Tako je.;-Točno tako.;-Točno.
Varovanje bo planilo nate, a?;Varovanje bo planilo nate, a?;Ne moreš jo zadržati zunaj, kajne?;Nikdar nisi maral svoje pisarne, kajne?
In povedem jih v nesmiseln lov.;In povedem jih v nesmiseln lov.;Samo razumeti skušam.;In ta posel, ta poslednji posel, tako pridem tja.
Le se vrnite se pred trzajem.;Le se vrnite se pred trzajem.;Spomnite se urjenja.;Se bojim da... Pokrijte ga!
Pojdi spančkat, gospod Eames.;Pojdi spat, gospod Eames.;Povejte mu, gospod Cobb.;Oprosti mi za zahtevo po čem bolj dorečenem, Eames.
Si v redu?;Si v redu?;Si v redu?;Si v redu?
Ej, bo šlo?;Ej, bo šlo?;Boš čakal?;Kako boš vedel?
-Ja, ja.;-Ja, ja.;-Ja, ja.;-Ja, dobro.
V redu.;V redu.;V redu.;V redu.
Pripravljen sem.;Pripravljen sem.;Navdušen sem.;Vem, da sem.
Cobb?;Cobb?;Cobb?;Cobb?
Cobb?;Cobb?;Cobb?;Cobb?
Kaj je tam spodaj?;Kaj je tam spodaj?;Kaj se dogaja tam zgoraj?;In kaj vraga je tam spodaj?
Močno upam da resnica, ki hočemo da jo Fischer zve.;Močno upam, da resnica, ki hočemo, da jo Fischer zve.;Mišljeno je bilo, da temeljito preveriš Fischerjevo ozadje!;Upajmo, da bo Fischerju všeč, kar bo našel tam notri.
Reči hočem, kaj je tam dol zate?;Reči hočem, kaj je tam dol zate?;Si me prišel ubit?;Veš kako me najti.
A ste videli tole?;A ste videli tole?;Kaj se je tu zgodilo?;Kaj je bilo to?
Eames, to so tvoje sanje.;Eames, to so tvoje sanje.;Ne počni tega, Mal, prosim te.;Veš kako me najti.
Moraš oddaljiti varovanje od kompleksa, razumeš?;Nikdar nisi maral svoje pisarne, kajne?;Sedaj ne sanjaš, kaj?;Veš vsaj, kako je biti ljubica?
Kdo bo povedel Fischerja vanj?;Kdo bo vodil Fischerja tja?;Kdo je le v redu?;Kdo bi rad v sanjah obtičal 10 let?
-Jaz ne.;-Jaz ne.;-Ne, nisem.;-Pravzaprav ne.
Če poznam pot, bi vse ogrozil.;Če poznam pot, lahko vse ogrozim.;Ne bi bil tukaj, če bi poznal kakšen drug način.;Mislim, da sem našel pot domov.
Jaz sem dizajnirala.;Jaz sem oblikovala.;Jaz sem silil v to.;Ideja... zaradi katere si posumila v realnost, je prišla od mene.
-Ne, ti greš z mano.;-Ne, ti greš z mano.;-Ne smem ti povedati.;-Mal, prekleto, ne počni tega.
Jaz bi zmogel.;Jaz bi zmogel.;Bilo bi mogoče.;Vem, da sem.
Prav, objasni jim pot v kompleks?;Prav, objasni jim pot v objekt.;Zakaj hudiča so nas napadli?;Kaj hudiča bomo pa sedaj?
Fischer, ti boš šel z njim.;Fischer, ti boš šel z njim.;Ti, pridi, greva ga pretrest.;Cobb, s tabo grem.
-Prav.;-Prav.;-Prav.;-Ja, v redu.
Kaj pa ti?;Kaj pa ti?;Mal, kaj počneš tu?;Ti ne greš noter?
-Imej to prižgano.;-To imej prižgano.;-Naj si ga pogledam.;-Ne, ti greš z mano.
Nenehno vas bom poslušal.;Nenehno vas bom poslušal.;Spomnite se, kaj sem vam rekel.;Improviziral bom.
Okna v nadstropju mi zgledajo dosti velika, da vas zakrijejo pred južnim stolpom.;Okna v nadstropju izgledajo dovolj velika, da vas zakrijejo pred južnim stolpom.;Niti vodja mojih varnostnikov ne pozna tega stanovanja.;Nisem opazil, da bi bil kdo tu.
Vidiš?;Vidiš?;Vidiš?;Ja, halo?
Ja.;Ja.;Ja.;Ja.
Ti ne greš noter?;Ti ne greš noter?;Si dobro?;Kaj pa ti?
-Da boš izvedel resnico o svojem očetu, moraš v Browningov um vlomiti sam.;-Da boš izvedel resnico o svojem očetu, moraš v Browningov um vlomiti sam.;-Če utegneš trenutek, ti gospod Cobb ponuja posel, o katerem bi se rad pomenil s tabo.;-Mar ni Cobb rekel, naj tega ne delamo?
Pridi, Fischer!;Pridi, Fischer!;Pridita noter!;Ej, gospod Cobb!
Oznani preplah!;Sproži alarm!;Prebudi ga!;Hej, tam!
Alarm!;Alarm!;Freddy!;Tam!
-Gremo, gremo, ajde, dajmo!;-Gremo, gremo, ajde, dajmo!;-Proč bežite!;-Očka, očka!
Krenimo!;Krenimo!;Pojdita!;Ostanite tu!
Ajde!;Ajde!;Hej, tam!;Hej?
Ustrelili me bodo!;Ustrelili me bodo!;Te barabe se že dva dni znašajo nad mano!;Ker so mnenja, da sem jo ubil.
Upam, da so pripravljeni.;Upam, da so pripravljeni.;Prisegam, da sem verjel v uspeh.;Mislim, da sem našel pot domov.
Ne, prezgodaj je še.;Ne, prezgodaj je še.;Prezgodaj je še.;Saj ni važno.
Cobb, slišiš to?;Cobb, slišiš to?;Ti še kar sanjaš, Cobb?;Cobb, pa ostali to vedo?
Prvič sem zaslišal pred kakšnimi 20 minutami.;Prvič sem zaslišal pred kakšnimi 20 minutami.;Me je poklical k svoji smrtni postelji.;Potem me je zgrabila panika.
Mislil sem, da je veter.;Mislil sem, da je veter.;Sem mislil, da je prosto.;Škoda, res sem hotel vedeti, kaj se bo zgodilo tamle notri.
Slišim, ja.;Slišim, ja.;O ne, ne, ne.;Bi rekla, ja.
Glasba je.;Glasba je.;Kombinacija.;Tu je.
Kaj bomo?;Kaj bomo?;Kaj zdaj?;Kaj ko bi odšli domov?
Podvizajmo se.;Obrnite se!;Pohitimo.;Umaknite se.
Yusuf je 10 sekund od skoka.;Yusuf je 10 sekund od skoka.;Cobb, dobiti morava Fischerja.;To je moj sin, James.
Kar pomeni, da ima Arthur 3 minute.;Kar pomeni, da ima Arthur 3 minute.;Arthur ima nekaj minut, mi jih imamo okrog 20.;Videti je, da smo si pridobili svojih 10 ur.
Hej!;Hej!;Hej!;Hej?
Koliko imamo mi?;Koliko imamo mi?;Kaj nam to koristi?;Koliko članov ekipe?
-60 minut.;-60 minut.;-ZDA.;-Vnovič.
-Lahko pot opravijo v eni uri?;-Lahko pot opravijo v eni uri?;-Ko vstavimo idejo, kako pridemo ven?;-Kako se torej znajdemo tu?
Še dol na srednjo teraso morajo splezati.;Še na srednjo teraso morajo splezati.;Prav, objasni jim pot v objekt.;Pridejo se prebujat.
-Potlej potrebujejo novo pot.;-Zdrsnemo v limbo.;-Ko se boš odkrižal zasledovalca.;-Potem vlomiš in jih ukradeš.
Bolj direktno.;Ni problema.;Bi rekla, ja.;Ja, mislim da.
Hej, tam!;Hej, tam!;Hej!;Hej!
Dizajnirano je kot labirint.;Načrtovano je kot labirint.;Lahko je kakršnekoli velikosti nadstropja do celega mesta.;Ideja je kot virus.
-Mora biti prehod, kjer ga lahko presekamo, drži?;-Mora biti prehod, kjer ga lahko presekamo, drži?;-Ko vstavimo idejo, kako pridemo ven?;-Lahko pot opravijo v eni uri?
Eames?;Eames?;Cobb?;Cobb?
Je Eames karkoli dodal?;Je Eames karkoli dodal?;Je dodal kakšno reč?;Kaj se je zgodilo?
-Ne smem ti povedati.;-Ne smem ti povedati.;-Noče mi povedati.;-Ne, ti greš z mano.
Če izve Mal ...;Če izve Mal...;Če skočim...;Zakaj si...
Nimamo časa.;Nimamo časa.;Nimamo časa.;Nimamo časa.
Je dodal kakšno reč?;Je dodal kakšno reč?;Je Eames karkoli dodal?;Kaj, da je bil razočaran?
Ja, dodal je prezračevalni sistem, ki poteka skozi labirint.;Ja, dodal je prezračevalni sistem, ki poteka skozi labirint.;Ja, vsak dan ga prečkam na poti na univerzo.;Okna v nadstropju izgledajo dovolj velika, da vas zakrijejo pred južnim stolpom.
Dobro.;Dobro.;Dobro.;Ja, mislim da.
Objasni jim ga.;Objasni jim ga.;Pokaži mu.;Povej nam, kar veste.
-Saito?;-Saito?;Saito?;Saito?
-Izvoli, povej.;-Izvoli, povej.;-Hej, poslušaj me.;-Pomiri se.
Paradoks.;Paradoks.;Paradoks.;Labirint.
Kaj je bilo to?;Kaj je bilo to?;Kaj je to?;Kaj je to?
-Trzaj.;-Trzaj.;-Stopi noter.;-Fischer, past je.
Cobb, smo ga zgrešili?;Cobb, smo ga zgrešili?;Cobb, pa ostali to vedo?;Cobb, slišiš to?
-Ja, zgrešili ste ga.;-Ja, zgrešili ste ga.;-Ni res.;-Bi rekel, da v redu.
Ej, mar namesto tega nihče ni mogel sanjati preklete plaže?;Ej, mar namesto tega nihče ni mogel sanjati preklete plaže?;Pa ti, vedel si za to in nič zinil?;Ta kraj je resničen, kaj ne?
Kaj?!;Kaj?!;Kaj?;Kaj?
Kaj hudiča bomo pa zdaj?;Kaj hudiča bomo pa sedaj?;Ej, bo šlo?;Zakaj hudiča so nas napadli?
Opravili bomo posel pred naslednjim trzajem.;Opravili bomo posel pred naslednjim trzajem.;Našli ga bomo.;Nadaljevali bomo s poslom in ga opravili kar se le da hitro in izstopili bomo z rabo trzaja.
-Katerim naslednjim?;-Katerim naslednjim?;-Zakaj?;Kaj, z Mal?
Ko bo kombi udaril v vodo.;Ko bo kombi udaril v vodo.;Ej, bo šlo?;In, ko se bo vrnila...
Če hočete poklicati, prosim, odložite slušalko in poskusite znova.;Če hočete poklicati, prosim odložite slušalko in poskusite znova.;Gotovo vas je dala na čevelj razen, če ima njena telefonska res le 6 številk.;Torej me na mojem cilju lahko spustite ven.
Če rabite pomoč ... Kako naj vas spustim brez gravitacije?;Če rabite pomoč... Kako naj vas spustim brez gravitacije?;Tiralica na mojo glavo, me hočejo mrtvega ali živega?;Če so to sanje... Se moram ubiti, da se prebudim, ni res?
Arthur ima par minut, mi jih imamo okrog 20.;Arthur ima nekaj minut, mi jih imamo okrog 20.;Dobiva se spodaj v točilnici recimo, čez pol ure.;Videti je, da smo si pridobili svojih 10 ur.
Bo šlo?;Bo šlo?;Ej, bo šlo?;Kaj hudiča bomo pa sedaj?
Obrnite se!;Obrnite se!;Povejte, kar veste!;Umaknite se!
Gremo k bazi!;Gremo k bazi!;Pohitimo.;Gremo na vožnjo.
Nekaj ni v redu.;Nekaj ni v redu.;Nisem prepričan, da je potrebno.;Nič nima opraviti s tem.
Proti vama so krenili, kot bi nekaj vedeli.;Proti vama so krenili, kot bi nekaj vedeli.;Mislila je, da sta predstavitev.;Nisi mogel scat preden smo prišli sem.
Pridobi nama še nekaj časa.;Pridobi nama še nekaj časa.;Stopi nazaj, da se pogovoriva o tem.;Vrni se z mano.
Velja?;Velja?;Velja?;Čutite?
Pridi!;Pridi!;Pridi!;Pridi sem!
Že grem.;Že grem.;Saj že spim.;Gremo na vožnjo.
Predsoba je.;Predsoba je.;Velja, ko smo budni.;Dovolj dobro je.
Še močneje zaščitena.;Še močneje zaščitena.;Samo presneto težka.;Ampak zagotovo narejena iz volne.
-Pa ima ta blindirana soba kaj oken?;-Pa ima ta predsoba soba kaj oken?;-Poizkus za kaj?;-Naj te jaz nekaj vprašam?
Rekla bi, da bi ne bila blindirana, če bi jih imela.;V resničnem svetu bi lahko izbirala, tukaj pa ne.;Kar pomeni, da ne ležim na lastni preprogi v svojem stanovanju.;Le to sem hotela videti, kakšne teste tu sam počneš vsako noč.
Upajmo, da bo Fischerju všeč, kar bo našel tam notri.;Upajmo, da bo Fischerju všeč, kar bo našel tam notri.;Upajmo le, da se moti.;Očitno je to ideja, ki jo bo Robert zavrnil.
So te projekcije del njegove podzavesti?;So te predstavitve del njegove podzavesti?;Kot projekcije zasledujejo sanjajočega?;Je tole čutiti resnično?
-Da.;-Da.;-Da.;-Da.
Mu uničuješ ta del uma?;Mu uničuješ ta del uma?;Kaj čutiš?;Čemu si mi to zakuhala?
-Ne, ne.;-Ne, ne.;-Ne, ne.;-Ne, nisi ti.
Samo projekcije so.;Samo predstavitve so.;To je vse.;V sanje sploh ne pridejo.
Prispela sva.;Prispela sva.;Dovolj sva govorila.;Ampak... Debatirala sva vsaj kakšno uro.
-Pot je prosta, a pohitita.;-Pot je prosta, a pohitita.;-Odnesimo ga gor.;-Kušni me nekam.
Nad vaju gre cela vojska.;Nad vaju gre cela vojska.;Vožnja tja dol je nestabilna kot sam vrag.;Kar vabi veliko pozornosti na nas.
Notri sva.;Notri sva.;Dovolj sva govorila.;V svetu, ki sva ga skupaj zgradila.
Sem dol!;Sem dol!;Drekač!;Mal, ne!
Še nekdo je netri.;Še nekdo je notri.;Videl sem jo že.;No, pa ni.
-Fischer, past je.;-Fischer, past je.;-Trzaj.;-Velja.
Ven beži!;Ven beži!;Eames!;Eames!
Ajde, pridi.;Ajde, pridi.;Ej, poglej me.;Kar, le daj.
Še malo nižje.;Še malo nižje.;Zgoraj?;V to smer.
Cobb ... Ne, ona ... Ni resnična.;Cobb... Ne, ona... Ni resnična.;Ne, da bi se jo zavedal.;Ni kot ti.
Kako veš?;Kako veš?;Kako boš vedel?;Me slišiš?
-Le projekcija je.;-Kombinacija.;-Mal je ubila Fischerja.;-Tako je.
-Fischer ... Fischer je realen!;-Fischer... Fischer je realen!;-Zbudite me!;-Zbudite me!
Živjo.;Živjo.;Živjo, otroka.;Živjo, očka.
Eames!;Eames!;Eames!;Eames!
Eames!;Eames!;Eames!;Eames!
Takoj pojdi v predsobo!;Takoj pojdi v predsobo!;Spravi ga v sobo!;Nikar ne počni tega!
Kaj se je zgodilo?;Kaj se je zgodilo?;Kaj se je zgodilo?;Kaj se je tu zgodilo?
-Mal je ubila Fischerja.;-Mal je ubila Fischerja.;-To se vas ne tiče.;-Pot je prosta, a pohitita.
Nisem je mogel ustreliti.;Nisem je mogel ustreliti.;Vedel sem, da je nekaj narobe z njo.;Položil sem mu jo ob posteljo, niti opazil je ni.
Nima ga smisla oživljati.;Nima ga smisla oživljati.;Ne bi smela biti tu.;Ne morem ti dopustiti, da ga uničiš.
Njegov um je že ujet tam spodaj.;Njegov um je že ujet tam spodaj.;Tako, ko zreš v totem, brez dvoma veš, da nisi v sanjah nekoga drugega.;Predmet je uvidel, da sanja in njegova podzavest nas je uničila na koščke.
Vsega je konec.;Vsega je konec.;Končano je.;Čas je potekel.
Tako torej?;Tako torej?;Kaj torej?;Torej...
Nismo uspeli?;Nismo uspeli?;Da smo že izvajali?;Zakaj hudiča so nas napadli?
Končano je.;Končano je.;Vsega je konec.;Čas je potekel.
Žal mi je.;Žal mi je.;Žal mi je.;Žal mi je, Robert.
No, nisem jaz ta, ki se mora vrniti k svoji družini, mar ne?;No, nisem jaz ta, ki se mora vrniti k svoji družini, mar ne?;A ne moremo delati zgolj, na osnovi govoric, kajne?;Kar pa sploh ni res, kajne?
Škoda, res sem hotel vedeti, kaj se bo zgodilo tamle notri.;Škoda, res sem hotel vedeti, kaj se bo zgodilo tamle notri.;Vedel sem, da je nekaj narobe z njo.;Le to sem hotela videti, kakšne teste tu sam počneš vsako noč.
Prisegam, da sem verjel v uspeh.;Prisegam, da sem verjel v uspeh.;Mislim, da sem našel pot domov.;Upam, da so pripravljeni.
Podstavimo eksploziv.;Pohitimo.;Nastavimo eksploziv.;Sledimo Fischerju tja dol.
Ne, obstaja še en način.;Ne, obstaja še en način.;To je druga možnost.;Obstaja izhod.
Sledimo Fischerju tja dol.;Sledimo Fischerju tja dol.;Pohitimo.;Gremo na vožnjo.
Nimamo časa.;Nimamo časa.;Nimamo časa.;Nimamo časa.
-Ne, a tam spodaj ga bo zadosti.;-Ne, a tam spodaj ga bo zadosti.;-No ja, ne bo držalo.;-Bi rekel, da v redu.
Našli ga bomo.;Našli ga bomo.;Prebudil ga bom.;Opravili bomo posel pred naslednjim trzajem.
Čim zaslišimo Arthurjovo glasbo, ga oživimo s šokom defibrilatorja.;Čim zaslišimo Arthurjevo glasbo, ga oživimo s šokom defibrilatorja.;Takoj, ko glasba preneha, razstreliš bolnico, in vsi se s trzajem vrnemo z nivoja.;Tam spodaj mu lahko damo njegov trzaj.
Tam spodaj mu lahko damo njegov trzaj.;Tam spodaj mu lahko damo njegov trzaj.;Tako bomo dobili krasen, sinhroniziran trzaj.;Le se vrnite se pred trzajem.
Spravi ga tja noter.;Spravi ga tja noter.;Daj, stopi nazaj noter.;Spravi ga v sobo!
Takoj, ko glasba preneha, razstreliš bolnico, in vsi se s trzajem vrnemo z nivoja.;Takoj, ko glasba preneha, razstreliš bolnico, in vsi se s trzajem vrnemo z nivoja.;Za občutek padanja gre, dobiš trzljaje, ki te predramijo.;Arthur ima nekaj minut, mi jih imamo okrog 20.
Velja poizkusiti.;Izplača se poizkusiti.;Poskusite.;Prav, pojdimo.
In Saito lahko straži, medtem, ko bom jaz nameščal eksploziv.;In Saito lahko straži, medtem, ko bom jaz nameščal eksploziv.;Ne vem, ali ne moreš, ali pa nočeš videti kaj se dogaja, a Cobb ima resne probleme, ki jih skuša pokopati tam spodaj.;Upam, da imaš kaj bolj elegantnega v mislih, kot da me ustrelijo v glavo.
Saito ne bo preživel, kajne?;Saito ne bo preživel, kajne?;Cobb ne more več graditi, kajne?;Kar pa sploh ni res, kajne?
Žilav je ... Ne vem ... -Cobb, pridi.;Žilav je... Ne vem... -Cobb, pridi.;Mal... -Pridi ven na polico, sicer bom skočila.;Ti, pridi, greva ga pretrest.
Poizkusiti morava.;Poizkusiti morava.;Morava si izmisliti nekakšen trzaj.;Izplača se poizkusiti.
Pojdita!;Pojdita!;Pridita noter!;Gremo k bazi!
Če vaju ne bo nazaj do trzaja, grem z ali brez vaju.;Če vaju ne bo nazaj do trzaja, grem z vama ali brez.;Torej me na mojem cilju lahko spustite ven.;Posedel bom kar na temle nivoju, pobje.
Prav ima.;Prav ima.;Ona ima prav.;Ja, prav.
Ona ima prav.;Ona ima prav.;Prav ima.;Prav.
Ti lahko zaupam, pa karkoli že naj se zgodi?;Ti lahko zaupam, pa karkoli že naj se zgodi?;Hočeš torej, naj še nekomu dopustim slediti v tvojo fantazijo.;Če ostanem tu, mu boš pustila oditi?
Mislim, tam spodaj bo Mal.;Mislim, tam spodaj bo Mal.;Da, a rad bi ju videl tam zgoraj, Mal.;Sem mislil, da je prosto.
Vem, kje jo najdem.;Vem, kje jo najdem.;Veš, kako me najdeš.;Veš kako me najti.
Imela bo Fischerja.;Imela bo Fischerja.;Upajmo, da bo Fischerju všeč, kar bo našel tam notri.;Zdaj ji realnost ne bo zadostovala.
-Kako veš?;-Kako veš?;-Kako veste?;-Kaj, če se motiš?
Ker hoče, da pridem za njo.;Ker hoče, da pridem za njo.;Hoče me spet imeti tam spodaj ob sebi.;Če grem brez tebe, jih bodo vseeno odvedli.
Hoče me spet imeti tam spodaj ob sebi.;Hoče me spet imeti tam spodaj ob sebi.;Ker hoče, da pridem za njo.;Ne morem več ostati z njo, ker ne obstaja.
Si v redu?;Si v redu?;Si v redu?;Si v redu?
Je to vajin svet?;Je to vajin svet?;Je varno zate, da si tukaj?;Kaj pa vajina otroka?
Bil je.;Bil je.;Ta je bil njen.;Bil sem ji kos.
Tukaj bo.;Tukaj bo.;Našli ga bomo.;Mislim, tam spodaj bo Mal.
Pridi.;Pridi.;Pridi.;Pridi.
Saito?;Saito?;Saito?;Saito?
Saito?;Saito?;Saito?;Saito?
Moraš ...;Moraš...;Povej mi...;Želel bi...
Moraš skrbeti za Fisherja, ko grem podstavljat eksploziv, prav?;Moraš skrbeti za Fisherja, ko grem nastavit eksploziv, prav?;Odvedi Fischerja s sabo, prav?;Si me prišel ubit?
»Pri tem poslu ni prostora za turiste«.;»Pri tem poslu ni prostora za turiste«.;»Razdelil bom očetov imperij«.;To bi izničilo njen namen.
No, se vidiva.;No, se vidiva.;Milo rečeno.;Ja, mislim da.
Vse to sta zgradila?;Vse to sta zgradila?;Vse to sta ponovno zgradila iz svojih spominov?;Kako dolgo sta obtičala tam?
To je neverjetno.;To je neverjetno.;Vem, kaj je to.;To je vse.
Gradila sva leta.;Gradila sva leta.;Delala sva mnogo let.;Skupaj sva delala.
Začela sva s spomini.;Začela sva s spomini.;Raziskovala sva koncept sanj znotraj sanj.;Skupaj sva bila mladeniča.
V to smer.;V to smer.;V resnični svet.;Hitro.
To je najina soseska.;To je najina soseska.;To sta najina otroka.;Tole je najino prvo stanovanje, nato pa sva se preselila v zgradbo tamle.
Kraji iz najine preteklosti.;Kraji iz najine preteklosti.;V resnični svet.;Da naju pristni čakajo nekje tam spodaj.
Tole je najino prvo stanovanje, nato pa sva se preselila v zgradbo tamle.;Tole je najino prvo stanovanje, nato pa sva se preselila v zgradbo tamle.;To je najina soseska.;Ko je Mal zanosila, je tisto postal najin dom.
Ko je Mal zanosila, je tisto postal najin dom.;Ko je Mal zanosila, je tisto postal najin dom.;Tole je najino prvo stanovanje, nato pa sva se preselila v zgradbo tamle.;To je najina soseska.
Vse to sta rekonstruirala iz svojih spominov?;Vse to sta ponovno zgradila iz svojih spominov?;Vse to sta zgradila?;Kako dolgo sta obtičala tam?
Kot sem ti rekel, imela sva veliko časa.;Kot sem ti rekel, imela sva veliko časa.;Pogrešal, te bom bolj, kot lahko prenašam, toda... Imela sva svoj skupni čas.;Skupaj sva bila mladeniča.
Kaj je to?;Kaj je to?;Kaj je to?;Kaj je bilo to?
Hiša, v kateri je Mal odraščala.;Hiša, v kateri je Mal odraščala.;Hotelska soba, kjer naj bi preživela najino obletnico poroke.;Ko je Mal zanosila, je tisto postal najin dom.
Bo tu notri?;Bo tu notri?;Eames!;Eames!
Ne.;Ne.;Ne.;Ne.
Pridi.;Pridi.;Pridi.;Pridi.
Oba sva hotela živeti v hiši, a rada sva imela takšen tip zgradbe.;Oba sva hotela živeti v hiši, a rada sva imela takšen tip zgradbe.;Tole je najino prvo stanovanje, nato pa sva se preselila v zgradbo tamle.;Ko je Mal zanosila, je tisto postal najin dom.
V resničnem svetu bi lahko izbirala, tukaj pa ne.;V resničnem svetu bi lahko izbirala, tukaj pa ne.;Ne bi bil tukaj, če bi poznal kakšen drug način.;Kar pomeni, da ne ležim na lastni preprogi v svojem stanovanju.
Kako bova vrnila Fischerja?;Kako bova vrnila Fischerja?;Bi nama naklonil še 5 minut?;Kdo bo vodil Fischerja tja?
Morava si izmisliti nekakšen trzaj.;Morava si izmisliti nekakšen trzaj.;Poizkusiti morava.;Veš kako me najti.
-Kakšen?;-Kakšen?;-Poizkus za kaj?;-Za kaj?
Improviziral bom.;Improviziral bom.;Nenehno vas bom poslušal.;Mislim, da sem našel pot domov.
Lej, nekaj moraš vedeti o meni.;Poglej, nekaj moraš vedeti o meni.;Veš, kaj moram storiti.;Saj veš, da tega ne morem storiti.
Glede saditve.;Glede saditve.;Če si lahko pridobite prava priporočila.;-Tako kot »saditve«.
Ideja je kot virus.;Ideja je kot virus.;To je vse.;Enostavno, majhno idejo, ki bo prav vse spremenila.
Odporna.;Odporna.;Prilagodljiva je.;Mučna.
Zelo nalezljiva.;Zelo nalezljiva.;Zelo kužna.;Napadejo kot bele krvničke, ki se bore zoper okužbo.
Že najmanjše seme ideje lahko vzklije.;Že najmanjše seme ideje lahko vzklije.;Pravega navdiha ni možno poneveriti.;Seme, ki ga bomo vsadili temu človeku v um, bo zraslo v idejo.
Zraste lahko, da te opredeli ... ali uniči.;Zraste lahko, da te opredeli... Ali uniči.;A bolečina... Bolečina je doumljiva, in sodeč po dekorju, smo v tvojem umu.;In če hočemo uspeti v tem, si boš moral odpustiti.
Najmanjša ideja, kot je: »Tvoj svet ni resničen«.;Najmanjša ideja, kot je: »Tvoj svet ni resničen«.;Ker je gradnja sanj iz lastnega spomina najlažji način izgube dojemanja kaj je resničnost in kaj so sanje.;Nihče ne mara, da mu nekdo drug išče po umu.
Enostavna, majhna misel, ki vse spremeni.;Enostavna, majhna misel, ki vse spremeni.;S tisto eno, povsem preprosto idejo, ki vse spremeni.;Resnice, da se Mal prebija skozi tvojo podzavest.
Tako prepričan o svojem svetu.;Tako prepričan o svojem svetu.;Torej... Ja, jaz... Obdelujem svoj totem.;Da ta svet ni resničen.
O tem, kaj je resnično.;O tem, kaj je resnično.;Da ta svet ni resničen.;Da je smrt edini izhod.
Misliš, da on je?;Misliš, da on je?;Razumeš?;Razumeš?
Kaj misliš, je izgubljen prav kakor jaz?;Kaj misliš, je izgubljen prav kakor jaz?;Če ostanem tu, mu boš pustila oditi?;Si prišel sem, da bi me ubil?
Vem, kaj je resnično, Mal.;Vem, kaj je resnično, Mal.;Vem, kaj je to.;Poglej, nekaj moraš vedeti o meni.
Brez nadležnih dvomov?;Brez nadležnih dvomov?;Brez občutkov preganjavice, Dom?;Uporabno?
Brez občutkov preganjavice, Dom?;Brez občutkov preganjavice, Dom?;Brez nadležnih dvomov?;Kako, da si zamočil s preprogo?
Te ne preganjajo anonimne korporacije in policija širom sveta?;Te ne preganjajo anonimne korporacije in policija iz vsega sveta?;Zakaj hudiča so nas napadli?;Ugrabitelji so delali zate?
Kot projekcije zasledujejo sanjajočega?;Kot projekcije zasledujejo sanjajočega?;So te predstavitve del njegove podzavesti?;Si ogledava nekaj paradoksalne arhitekture?
Priznaj.;Priznaj.;Poslušaj me.;Pomiri se.
V nobeno realnost več ne verjameš.;V nobeno realnost več ne verjameš.;Nič ti ni.;Veš, kam upaš da te popelje, ampak, nisi povsem prepričan.
Zato izberi.;Zato izberi.;Izberi ostati tu.;Izberi mene.
Izberi ostati tu.;Izberi ostati tu.;Izberi mene.;Zato izberi.
Izberi mene.;Izberi mene.;Poslušaj me.;Izberi ostati tu.
Veš, kaj moram storiti.;Veš, kaj moram storiti.;Veš, kaj moraš storiti.;Veš, kaj moraš storiti.
Moram se vrniti k najinima otrokoma, ker si ju zapustila.;Moram se vrniti k najinima otrokoma, ker si ju zapustila.;Osvobajam te krivde, ker si se odločil, da ju zapustiš.;Ta otroka, tvoja vnuka, čakata, da se njun oče vrne domov.
Ker si zapustila nas.;Ker si zapustila nas.;Ti si zgradila ta svet.;Privedel si nas na vojno območje brez povratka.
-Motiš se.;-Motiš se.;-Ti si arhitekt.;-Ne, nisi ti.
Ne, Mal.;Ne, Mal.;Ne, draga.;Ne, ne, ne.
-Zmeden si.;-Zmeden si.;-Tega ne veš.;-Ni res.
Najina otroka sta tukaj.;Najina otroka sta tukaj.;To sta najina otroka.;To je najina soseska.
In rad bi zopet videl njuna obraza, kajne?;In rad bi zopet videl njuna obraza, kajne?;Kar pa sploh ni res, kajne?;Ta kraj je resničen, kaj ne?
Da, a rad bi ju videl tam zgoraj, Mal.;Da, a rad bi ju videl tam zgoraj, Mal.;Mislim, tam spodaj bo Mal.;Škoda, res sem hotel vedeti, kaj se bo zgodilo tamle notri.
Zgoraj?;Zgoraj?;Še malo nižje.;Kaj je tam spodaj?
Poslušaj se vendar.;Poslušaj se vendar.;Kar, le daj.;Pojdi preverit, če je res, Ariadne.
To sta najina otroka.;To sta najina otroka.;To nista moja otroka.;Najina otroka sta tukaj.
Glej.;Glej.;Poglej se.;Vidiš?
James?;James?;James?;Eames?
Phillipa?;Phillipa?;Phillipa?;Ariadne?
Ne počni tega, Mal, prosim te.;Ne počni tega, Mal, prosim te.;Mal, prosim te, poglej me.;Saj veš, da tega ne morem storiti.
To nista moja otroka.;To nista moja otroka.;To sta najina otroka.;To nima veze z mano.
Stalno si to govoriš, a ne verjameš.;Stalno si to govoriš, a ne verjameš.;A to ti ni treba storiti sam.;Veš, kam upaš da te popelje, ampak, nisi povsem prepričan.
Ne, vem.;Ne, vem.;Ne vem.;Ja, jaz tudi ne.
-Kaj, če se motiš?;-Kaj, če se motiš?;-Kako veš?;-Zakaj pa?
Kaj če sem jaz tisto resnično?;Kaj če sem jaz tisto resnično?;Ti lahko zaupam, pa karkoli že naj se zgodi?;Če so to moje sanje, zakaj jih ne morem nadzorovati?
Nenehno si dopoveduješ, kar veš.;Nenehno si dopoveduješ, kar veš.;Še vedno se lahko držiš obljube.;Zavestno ustvariš vsak vidik.
A kaj verjameš?;A kaj verjameš?;Kako veš?;Sedaj ne sanjaš, kaj?
Kaj čutiš?;Kaj čutiš?;Kaj delaš?;Kaj si izvedel?
