Jaz pa se ne bom predal brez borbe.;In ne bom se predal brez boja.
To sem opazil.;To mi je bilo zelo všeč.
Torej še enkrat mi povejte o svojem partnerju.;Povejte mi še enkrat o tem partnerju.
Kakšnem partnerju?;Katerem partnerju?
Bojim se, da greste v napačno smer.;Bojim se, da je v drugo smer.
Če počakate trenutek, bom... našel nekoga, ki vas bo pospremil do pomola.;Če počakate, bom poiskal koga, ki vas lahko odpelje do doka.
-To je samo pomirjevalo.;-To je čar vsega tega.
Samo previdnostni ukrep.;Previdnostni ukrep.
Kaj... kaj boste storili?;Kaj boste naredili?
Zaradi česa?;Od česa?
In oprostite, kaj pa vas ne provocira?;Kaj je pa potem tole, jebenti?
"Ste vedeli, da beseda ""travma"" izhaja iz grške besede za ""rano""?";"Ste vedeli, da beseda travma izhaja iz grške besede za ""rana""?"
"In kaj je nemška beseda za ""sanje"".";In kaj naj bi to bilo?
In vi... vi ste ranjeni, Marshal.;In vi, vi ste ranjeni, šerif.
Ali se ne strinjate, da ko vidiš pošast, jo moraš zaustaviti.;Ko vidiš pošast, jo moraš ustaviti, se strinjate?
-Da... Kaj delaš, Ijubček?;-Ja ... Kaj delaš, dragi?
Če cel svet misli, da je Chuck mrtev, potem je idealen za njihove poskuse.;Če svet misli, da je Chuck mrtev, je popoln za njihove poskuse.
Samo eno mesto obstaja, kamor bi ga odpeljali.;Samo en kraj je, kamor bi ga odpeljali.
Če ga mučijo, če imajo zaprtega proti njegovi volji, mu moram pomagati.;Če ga zadržujejo proti njegovi volji, moram to razkriti.
Nikogar več ne smem izgubiti.;Nikogar več ne morem izgubiti.
Prosim, ne delaj tega.;Prosim, ne počni tega, Teddy.
Ne odhajaj tja.;Ne hodi tja.
To stvar imam rad zato, ker si mi jo ti dala.;Všeč mi je, ker si mi jo ti dala, a resnica je, da je to ena presneto grda kravata.
Res pa je, da je to samo ena pofukano grda kravata.;Všeč mi je, ker si mi jo ti dala, a resnica je, da je to ena presneto grda kravata.
Ne premikaj se!;Ne premikajte se!
Me boš... me boš ubil?;Zakaj me nisi rešil?
Ne, ne bom te ubil.;Ne bom vas ubil.
Zakaj si vsa mokra, punči?;Zakaj si vsa mokra, ljubica?
-Saj veste, kaj sem rekel.;-Natančno veste, kaj sem rekel.
Mimogrede, puška je prazna.;Mimogrede, puška ni nabita.
Za božjo voljo posušite se, še prehladili se boste.;Zaboga, posušite se, saj se boste še prehladili.
Kako hudo ste poškodovali stražarja?;Kako močno ste poškodovali stražarja?
Jaz... Ne vem, o čem govorite.;Ne vem, o čem govorite.
Naj Dr. Sheehan dobro pregleda vaše fante, preden ga pošIjete gor.;Naj dr. Sheehan pregleda vašega človeka, preden ga pošljete gor.
Torej je dr. Shehan prišel danes zjutraj s trajektom.;Torej je dr. Sheehan prišel z jutranjim trajektom.
Ne ravno.;Ne prav veliko.
Raznesli ste moj avto.;Razstrelili ste mi avto.
Res sem imel rad ta avto.;Imel sem prijatelja.
Žal mi je za to.;Žal mi je.
Drgetanje postaja vedno hujše, je tako?;Kako je z vašo glavo?
Kako je s halucinacijami?;Kako je s prividi?
Pojdi ven od tod, Teddy.;Zbeži stran, Teddy.
Ta kraj te bo pokončal.;Ta kraj te bo pokopal.
Dr. Solando... povedala mi je za neuroleptike.;Dr. Solando mi je povedala za nevroleptike.
In kdaj je bilo to?;Zakaj pa je to bilo kaj takega?
-Doktorico sem našel v jami ob pečinah, ampak... nikdar je ne boste našli.;-Čez čeri sem plezal, da bi te rešil.
Ne dvomim v to.;Bojim se, da je v drugo smer.
Glede na to, da ni resnična.;O tem ne dvomim, glede na to, da ni resnična.
Vaše halucinacije so precej resnejše, kot smo mislili.;Vaše taktike na meni ne bodo delovale.
Kaj za vraga je potem to?;Kaj je pa potem tole, jebenti?
Kaj za vraga je to?;Kaj je to?
Od... od... od česa?;Od česa?
Niti preklete pijače nisem spil, odkar sem na tem otoku.;Odkar sem na tem otoku nisem spil niti kapljice.
Nisem ravno navdušenec farmakologije a v vašem primeru moram reči... Clorpro... clorproma... kaj?;Nisem pristaš zdravil, a v vašem primeru ... Kloro ... prom... kaj?
Isto zdravilo, ki ti ga dajemo zadnjih 24 mesecev.;Isto zdravilo, ki smo vam ga dajali zadnjih 24 mesecev.
Torej v zadnjih dveh letih... mi... mi je nekdo skrivaj dajal zdravila v Bostonu.;Dokler nisem našel nekoga, ki je bil tu pacient.
To pravite?;To ni izraz iz psihiatrije?
Tukaj ste že dve leti.;Dve leti ste že pacient te ustanove.
Po vsemu, kar sem tu videl, doktor, vi... res mislite, da me boste prepričali, da sem nor?;Po vsem, kar sem tu videl, doktor, res mislite, da me lahko prepričate v to, da sem nor?
Veste s kakšnimi Ijudmi imam opravka vsak dan?;Veste, s kakšnimi ljudmi se vsak dan srečujem?
Jaz sem Zvezni policist, za božjo voljo.;Zvezni šerif sem, zaboga.
-Bili ste Zvezni policist.;-Prišli ste odkrit resnico.
Tu je kopija vašega sprejemnega lista.;Tu je kopija vašega sprejemnega obrazca.
Vlomili ste na oddelek C, da bi dokazali obstoj 67-tega pacienta.;Vdrli ste na oddelek C zaradi dokaza o obstoju 67. pacienta.
Če bi prišel na celino, bi lahko razkrinkal ta kraj.;Če bi uspeli priti na kopno, bi razkrinkali to mesto.
Ampak nekako niste našli časa, da bi ga pogledali.;A nekako še niste našli časa, da bi to pogledali.
Preberite si ga.;Preberite ga zdaj.
Pacient je zelo inteligenten, zelo moten.;Pacient je zelo inteligenten in močno blodnjav.
Prisoten pri osvobajanju Dachaua.;Prisoten pri osvoboditvi Dachaua.
Ne obžaluje svoja kriminalna dejanja, ker zanika, da so se sploh zgodila.;Ne kaže obžalovanja za svoj zločin, ker zanika njegov obstoj.
Visoko razvita fantastična sposobnost pripovedovanja, ki onemogoča soočenje z resničnostjo njegovih dejanj.;Psihiater, ki direktno nadzira njeno zdravljenje.
Dovolj mi je tega sranja.;Žal mi je, da to slišim.
Kje je moj parter, kaj?;Kje so moje presnete cigarete?
Poskusiva na drugačen način.;Poskusiva drugače.
"Dekliško ime vaše žene je bilo ""Chanal"".";Dekliški priimek vaše žene je bil Chanal, imam prav?
Niti ne omenjajte njenega imena!;Sploh je ne omenjajte!
-Bojim se, da ga bom moral.;-Rekel sem, da grem sam.
Ali opazite, kaj imajo ti štiri imena skupnega?;Opazite, kaj imajo ta štiri imena skupnega?
Če ste karkoli storili mojemu partnerju doktor, je to kršitev... Osredotočite se, Andrew.;-Če ste kaj naredili mojemu partnerju, je to kršitev ... -Zberite se, Andrew.
Imena... iz istih črk so sestavljena.;Imena so sestavljena iz istih črk.
Ime Edward Daniels je sestavljeno iz istih 13-ih črk kot ime Andrew Laeddis.;Ime Edward Daniels vsebuje istih 13 črk kot Andrew Laeddis.
Enako kot Rachel Solando in Dolores Chanal.;Prav tako Rachel Solando, če smo že pri tem.
Imena so med seboj anagrami.;Imena so medsebojni anagrami.
Vaša taktika, na meni ne bo delovala.;Vaše taktike na meni ne bodo delovale.
-Sem ste prišli po resnico.;-Prišli ste odkrit resnico.
Tukaj jo imate.;Tukaj ste.
Vi ste 67-ti pacient v Ashcliffu, Andrew.;Vi ste 67. pacient v Ashecliffu.
Sem ste bili izročeni s sodno odločbo pred 24-imi meseci.;-Pred 24 meseci ste bili sprejeti na podlagi sklepa sodišča.
Vaš zločin je strašen.;To je barbarsko.
Takšen, da si ne morete oprostiti.;Preveč, da bi si lahko predstavljal.
Tako da ste si izmislili drugi jaz.;Rekel sem, da ste ljudje nasilja.
Ustvarili ste zgodbo, v kateri vi niste motilec ampak heroj.;Bili ste v Dachauu, a niste mogli ubiti nobenega stražarja.
Še vedno Zvezni policist.;Še vedno je tu.
Ampak samo tukaj v Ashcliffu zaradi primera.;Vse to zaradi dr. Cawleyja.
In razkrili ste zaroto, tako da karkoli vam rečemo o tem kdo ste, kaj ste storili lahko smatrate za laž, Andrew.;Razkrili ste zaroto, zato da lahko vse, kar vam povemo o vas in vaših dejanjih, zavržete kot laži, Andrew.
-Moje ime je Edward Daniels.;-Ime mi je Edward Daniels.
To domišIjijo poslušam zdaj že dve leti.;Že dve leti poslušam to izmišljotino, poznam vsako podrobnost.
Vaš pogrešan partner.;Vaš izginuli partner.
Sanje, ki jih imate vsako noč.;Sanje, ki jih sanjate vsako noč.
Bili ste v Dachauu, ampak verjetno niste ubili nobenega stražarja.;Bili ste v Dachauu, a niste mogli ubiti nobenega stražarja.
Želim si, da bi vas lahko pustil živeti v vašem namišIjenem svetu.;Res si želim, da bi vas lahko pustil živeti v vašem izmišljenem svetu.
Ampak vi ste nasilni, trenirani, nevarni.;A ste nasilni, izurjeni in nevarni.
Ste najbolj nevaren pacient, kar jih imamo.;Ste naš najnevarnejši pacient.
Poškodovali ste bolničarje.;Poškodovali ste strežnike, stražarje in ostale paciente.
Pred dvema tednoma ste napadli Georga Noyca.;Pred dvema tednoma ste napadli Noycea.
Sedaj sem vas pa dobil, doktor!;Doktor, potem bom pa rekel - klinc pa njihov mir.
Vi ste dali Noyca pretepsti.;Vi ste dali Noycea pretepsti.
-Povejte mi en sam razlog, zakaj bi se ga sploh dotaknil?;Povejte mi en razlog, zakaj bi se ga jaz sploh dotaknil.
Ker vam je rekel Laeddis, vi pa bi naredila karkoli, da nebi bili on.;Ker vam je rekel Laeddis, vi pa bi naredili vse, da ne bi bili on.
Imam prepis pogovora, ki ste ga imeli včeraj z Noycem.;Imam prepis vajinega včerajšnjega pogovora.
To je v zvezi z vami in Laeddisom.;Sedaj ko ste omenili to, bo tole čisto v redu.
Vedno je šlo samo za to.;Vedno je šlo le za to.
"Pravi, da je to v zvezi z ""mano in Laeddisom"".";Prav tako verjame, da je to njen dom v Berckshiresu.
"Ko ste ga vprašali, kaj se je zgodilo z njegovim obrazom, je rekel: Tukaj zopet citiram, ""Ti si to storil"".";"Ko ste ga vprašali, kaj se je zgodilo z njegovim obrazom, je rekel, citiram: ""Ti si mi to naredil."""
S tem je mislil, da je bila moja krivda.;Povedala mi je, a je nisem poslušal.
Upravnik in upravni odbor so odločni, da je potrebno nekaj odločnega storiti.;Upravnik in nadzorniki so odločeni, da je treba ukrepati.
Da razen, če te ne spravimo k zdravi pameti takoj, takoj zdaj, bodo prevzete vse potrebne mere za zagotovitev, da ne boste nikdar več nikogar poškodovali.;Če vas takoj ne spravimo k razumu, bodo uvedeni dokončni ukrepi, ki bodo zagotavljali, da nikoli več ne boste mogli nikogar poškodovati.
Lobotomizirali vas bodo, Andrew.;Naredili vam bodo lobotomijo, Andrew.
Mislim, da sem vas popolnoma razumel.;A vedeti moram, da ste sprejeli resničnost.
Če se ne grem več te vaše male igrice tukaj, me bo dr. Naehring spremenil v enega svojih duhov.;Če ne bom sodeloval v tej vaši igrici, me bo dr. Naehring spremenil v enega od svojih prikazni.
Kaj bo pa z mojim partnerjem?;Kaj pa moj partner?
Boste razložili uradu Zvezne policije, da je on obrambni mehanizem?;Boste šerifovemu uradu rekli, da je obrambni mehanizem?
Kaj za vraga se dogaja tukaj?;Kaj se tu dogaja, jebenti?
Ti delaš zanj?;Delaš zanj?
Ni bilo druge možnosti.;Ni bilo pomembno.
Nekdo je moral biti stalno s teboj, da je pazil nate.;Nekdo te je moral varovati.
Ti si me opazoval, ne?;Nadzoroval si me, kajne?
Opazoval si me vsak trenutek.;Nadzoroval si me vsako minuto.
Kdo... kdo... kdo si ti?;Kdo si ti?
Tvoj glavni psihiater sem bil zadnje dve leti.;Zadnji dve leti sem bil tvoj glavni psihiater.
Jaz sem Lester Sheehan.;To vem, ker sem tudi jaz tak.
In... Povedal sem ti... povedal sem ti za svojo ženo.;Povedal sem ti za svojo ženo.
-Spustil sem se po pečini, da bi prišel do tebe.;-Čez čeri sem plezal, da bi te rešil.
Verjel sem ti.;Zaupal sem ti.
Jaz.. Jaz... tvegal sem vse, samo da bi prišel sem pote.;Nihče ne bi mogel priti ali oditi iz sobe, ne da bi ga jaz videl.
Časa nam zmanjkuje, Andrew, Pred upravnim odborom sem prisegel, da lahko pripravim najradikalnejšo, najmodernejšo predstavo, kadarkoli poskušano v psihiatriji, ki te bo vrnila nazaj.;Odboru nadzornikov sem prisegel, da lahko ustvarim najbolj radikalno in vrhunsko igro vlog v zgodovine psihiatrije, in da vas bo ta ozdravila.
Mislil sem, da če ti pustimo, da to odigraš do konca, boš spoznal, kako neresnično, kako nemogoče je to.;Če vam pustimo to odigrati, sem si mislil, boste lahko sprevideli, kako neresnično in nemogoče je to.
Povej mi, kje so Nacistični eksperimenti?;Povej mi, kako so te spravili sem?
Če ne bomo uspeli s tabo... potem bo zaman vse, kar smo poskušali narediti tukaj.;Če nam pri tebi spodleti, potem bo vse, kar smo tu poskušali narediti, izgubilo veljavo.
Tukaj smo na prvi liniji fronte, fant.;Šerif, trenutno smo vsi napeti.
In zdaj je vse odvisno od tebe.;Vse to je zate.
-Andrew... Andrew, ne!;-Andrew, ne, ne!
Moje ime je Edward Daniels.;Ime mi je Edward Daniels.
Ta je napolnjen.;Dok je edini možni vhod in izhod.
In to je vaše orožje, Marshal?;Kdo ti je to naredil, George?
Ste prepričani?;Ste ga videli?
Moji inicialki sta ob strani in udrtina je na cevi.;Vgravirane ima moje začetnice in na cevi udrtino od strelnega napada.
Philip Stacks je streljal name.;To je bil umor.
Ne boste se zajebavali z mojimi možgani pri tem, doktor.;Ne boste me jebali v glavo.
Potem pa streljaj, ker je to edini način, da prideš s tega otoka.;Potem pa nikoli ne boš zapustil tega otoka.
Moja pištola... Kaj ste naredili z mojo prekleto pištolo?;Moja pištola ... Kaj ste naredili z mojo pištolo?
-To je igrača, Andrew.;-To je otok.
Resnico ti govoriva.;Govoriva ti resnico.
Dolores je bila duševno bolna.;Dolores je bila nora.
Ti si pil.;Ti si tu.
Ostajal od doma.;Izginiva od tu.
Preselil si se v hišo ob jezeru, potem ko je ona namerno zažgala tvoje stanovanje v mestu.;Povedala sem ti, da se mi trga srce in vprašal si me zakaj.
Simon... Henry... -Nimam otrok.;Simon, Henry ... -Nisem imel otrok.
Tvoja žena jih je utopila.;Jaz sem jih ubil, ker ji nisem poiskal pomoči.
In tukaj, mala deklica o kateri sanjaš vsak večer.;In tale deklica, o kateri sanjate vsako noč.
Nikdar nisem imel male deklice.;Nisem imel deklice.
Tista, ki ti nenehno govori, da bi jo moral rešiti.;Človeka, ki ga ne moreš zaslišati, ker nima spominov, ki bi jih priznal.
Rešiti vse.;Rešiti njih vse.
Rachel ji je bilo ime.;Ime ji je bilo Rachel.
Boš zanikal, da je sploh kdaj živela.;Sem ti rekla, da ne hodi sem.
Andrew, boš zanikal?;Andrew, mar boste?
Tako mi je žal, Ijubček.;Tako mi je žal, srček.
Rekla sem ti, da ne prihajaj sem.;Sem ti rekla, da ne hodi sem.
To bo tvoj konec.;Da bo to tvoj konec.
Prijeli smo ga tik za mejo.;Ujeli smo ga tik za Oklahomo.
Zgleda, da se je ustavil najmanj desetkrat od tod do Tulse.;Do Tulse sem se moral ustaviti v 10 krajih.
Lahko bi spal teden dni skupaj.;Ves teden bi lahko spal.
Punči... Zakaj si vsa mokra?;Ljubica ... Zakaj si vsa mokra?
Domov bi šla rada.;Rada bi šla domov.
Sobota je, draga.;Sobota je, ljubica.
O moj Bog, ne!;O, mojbog, ne!
Ne, ne, prosim, Bog.;Ne, prosim, bog ...
Prosim, Bog, ne.;Prosim, bog, ...
Posadiva jih za mizo.;Posadiva jih za mizo, Andrew.
Posušila jih bova.;Posušila jih bova, jih preoblekla.
Preoblekla jih bova.;Ljubica ... Okopala jih bova.
Če si me sploh kdaj Ijubila Dolores, prosim utihni.;Naj me vrag, če vem!
Osvoboditi bi me moral!;Moral bi me rešiti.
Oh, punči... Skopala jih bova v kadi.;Ljubica ... Okopala jih bova.
Ljubim te, Dolores.;Ljubim te.
-Tudi jaz te Ijubim.;-Tudi jaz te ljubim.
Tako zelo te Ijubim, Dolores.;Tako zelo te ljubim.
-In jaz Ijubim tebe.;-Tudi jaz te ljubim.
Andrew, me slišiš?;Andrew, mar boste?
Rachel, Rachel Laeddis.;Niti Rachel Solando.
Moja hči.;Moja hčerka.
Zakaj si tukaj?;Zakaj ste tu?
-In zakaj si to storil?;-In zakaj ste to storili?
Ker je ubila najine otroke.;Ker ne morem prenesti spoznanja, da je Dolores ubila najine otroke.
In rekla mi je, da naj jo osvobodim.;Rekla mi je, naj jo izpustim.
-On ne obstaja.;-Ne obstaja.
Prav tako Rachel Solando.;Prav tako Rachel Solando, če smo že pri tem.
Izmislil sem si jih.;Izmislil sem si ju.
Po prvem poskusu samomora mi je Dolores rekla, da... da v njenih možganih živi insekt.;Po tem, ko se je prvič poskušala ubiti, mi je Dolores povedala, da ima žuželko, ki živi v njenih možganih.
Čutila ga je, kako koraka po njeni lobanji in vleče niti samo za zabavo.;Lahko jo je čutila, kako ji je udarjala po lobanji, jo za šalo vlekla za žičke.
To mi je povedala.;To mi je bilo zelo všeč.
To mi je povedala, pa je nisem poslušal.;Povedala mi je, a je nisem poslušal.
Tako zelo sem jo Ijubil.;Tako močno sem jo ljubil.
Ker ne morem razumeti, da je Dolores lahko ubila najine otroke.;Ker ne morem prenesti spoznanja, da je Dolores ubila najine otroke.
Jaz sem jih ubil, ker ji... ker ji nisem pomagal.;Jaz sem jih ubil, ker ji nisem poiskal pomoči.
Poslušaj mojo teorijo, Andrew.;Moja teorija je taka, Andrew.
Enkrat smo že prebili zid, pred devetimi meseci, nato si se vrnil v prejšnje stanje.;Če nam pri tebi spodleti, potem bo vse, kar smo tu poskušali narediti, izgubilo veljavo.
Tega se ne spominjam.;Tega se ne spomnim.
Resetiraš se, Andrew.;Ponovno se zaganjate, Andrew.
Kot kaseta, ki neskončno dolgo predvaja eno in isti ritem.;Kot trak, ki se znova in znova vrti v neskončni zanki.
Upam, da bo to, kar smo naredili tukaj dovolj, da ga ustavimo, da se nikdar več ne ponovi, ampak vedeti moram, če si se sprijaznil z realnostjo.;Upam, da je to, kar smo naredili, dovolj, da se ne bo več ponovilo.
Zavzeli ste se zame, doktor?;Šli ste za mano, doktor.
Poskušali ste mi pomagati, ko nihče drug ni hotel.;Poskušali ste mi pomagati, ko mi nihče drug ni hotel.
Moje ime je Andrew Laeddis in umoril sem svojo ženo spomladi 1952.;Ime mi je Andrew Laeddis in spomladi leta 1952 sem umoril svojo ženo.
Kako smo to jutro?;Kako smo kaj to jutro?
Ne morem se pritoževati.;Ne boste me jebali v glavo.
Kaj bo torej naš naslednji korak?;Kaj bo najin naslednji korak?
Spraviti se moram s te skale, Chuck.;Oditi morava s te skale, Chuck.
Nazaj na celino, karkoli za vraga se že dogaja tukaj, je slabo.;Karkoli že se tu dogaja, je zlo.
Ne skrbi, partner, ne bojo naju ulovili.;Ne skrbi, partner.
Prepametna sva za njih.;A tu sva zaradi Rachel Solando.
Ja, res sva.;Preveč južno sva.
Kaj to, šef?;Kaj pa, šef?
Kaj bi bilo slabše?;Kaj bi bilo huje?
Ko sem ležal v VI bolnišnici, sem bil pred veliko luknjo mojega življenja.;Ko sem ležal v veteranski bolnišnici z veliko praznino v svojem življenju, sem začel sanjati o letenju.
Začel sem sanjati, kako letim.;Ko sem ležal v veteranski bolnišnici z veliko praznino v svojem življenju, sem začel sanjati o letenju.
Prej ali slej, na koncu se vedno zbudiš.;Toda prej ali slej se moraš zbuditi.
V kriogenski komori ne sanjaš ničesar.;V kriospanju sploh ne sanjaš.
Ne občutiš, da je minilo šest let.;Ne zdi se kot šest let.
Tommy je bil znanstvenik, ne pa jaz.;Tommy je bil znanstvenik, ne jaz.
On je bil ta, ki je hotel potovati svetlobna leta daleč, da bi našel odgovore.;On je hotel potovati v vesolje in najti odgovore.
Smo že prispeli?;Smo že tam?
Ja, tukaj smo, sonček.;Smo, sonček.
Za tvojega brata gre.;Za vašega brata gre.
Teden dni, preden bi Tommy moral na ladjo je tip s pištolo končal njegovo potovanje.;Teden dni pred odhodom je Tommyja nekdo ustavil zaradi papirja v denarnici.
Zaradi papirja v njegovi denarnici.;Zaradi unobtanija.
V krio komori ste bili pet let, devet mesecev in 22 dni.;V kriu ste bili 5 let, 9 mesecev in 22 dni.
Lačni boste in slabotni.;Lačni in šibki boste.
Če vam bo slabo... Tommy je bil znanstvenik.;Ja, Tommy je bil znanstvenik.
Jaz sem samo še en bedak, ki gre nekam, kjer bo to obžaloval.;Jaz sem samo pešak, ki gre nekam, kamor si ne želi.
Pred nami je Pandora.;Pred nami je bila Pandora.
Ko sem odraščal, sem slišal o njej.;Slišal sem o njej, nisem pa si mislil, da bom šel tja.
Nisem pa si mislil, da bom kdaj šel tja.;Slišal sem o njej, nisem pa si mislil, da bom šel tja.
S teboj bi se radi dogovorili, da prevzameš njegovo pogodbo.;Ampak če si tu, bi te rad opozoril.
To bo svež začetek na novem svetu.;To bi bil nov začetek na novem svetu.
Tudi plačilo je dobro.;In plačilo je dobro.
Čez štiri minute boste mrtvi.;Če jih boste hoteli napasti, ne bo lahko.
Naj nihče ne umre danes, to bi izgledalo zelo slabo v mojem poročilu.;Lahko bi me zakrpali, če bi šel nazaj.
Eno življenje se konča drugo pa se začne.;Eno življenje se konča, drugo začne.
Ko se spustimo pojdite naravnost v bazo, brez ustavljanja!;Ko se rampa spusti, pojdite naravnost v bazo.
Morda nisi več zraven, a nikoli ne izgubiš navad.;To ti najbrž ne bo težko.
Rekel sem si, da bom prestal vsak test, ki ga lahko človek prestane.;Rekel sem si, da lahko opravim vsak test.
Ampak ne, če jim ne koristite, ne v tem gospodarstvu.;Ampak to se ne bo zgodilo.
Gremo, posebni primer, ne pusti me čakati.;Pa me vzemi s sabo.
Glej vse to sveže meso.;Poglej to sveže meso.
Nekoč na Zemlji so to bili vojaki, marinci.;Na Zemlji so bili vojaki in marinci, ki so se bojevali za svobodo.
Borili so se za svobodo.;Na Zemlji so bili vojaki in marinci, ki so se bojevali za svobodo.
Tukaj pa so bili samo najemniki, ki so delali za denar, za podjetje.;Tu pa so bili najemniki, ki delajo za denar.
Človek, to ni prav.;To ni prav.
Dame in gospodje, ste na Pandori.;Na Pandori ste, gospe in gospodje.
Če pekel obstaja, si lahko tam privoščite dopust, ko končate na Pandori.;Če obstaja pekel, pojdite tja na dopust po Pandori.
Tam zunaj za ograjo vas vsako živo bitje, ki hodi, leti, ali se plazi po blatu, želi ubiti in vas požreti.;Za tisto ograjo so plazeča se, leteča in čepeča bitja, ki vas hočejo ubiti in vam požreti oči.
Imamo tudi inteligentna, humanoidna bitja imenovana Na'vi.;Tu živijo tudi humanoidi, imenovani Na'vi.
Radi uporabljajo puščice namočene v živčni strup, ki vam v minuti ustavi srce.;Puščice namakajo v strup, ki ti v minuti ustavi srce.
Kosti imajo okrepljene z naravnimi ogljikovimi steklenimi vlakni.;Kosti imajo ojačane z naravnimi ogljikovimi vlakni.
Kot vodja varnosti imam nalogo, da vas obdržim žive.;Moja naloga je, da vas ohranim žive.
Če hočete preživeti, potrebujete močno voljo.;Če hočete preživeti, morate biti psihično trdni.
Ubogati morate pravila.;Ubogajte pravila.
Jake, saj si Jake, ali ne?;Norm, si v redu?
Podoben si mu.;Čisto si mu podoben.
Jaz sem Norm Spellman.;Jaz sem Trudy.
Skupaj sva bila na avatar treningu.;Skupaj sva bila na avatarskem urjenju.
Biološki laboratorij, tukaj bova preživela veliko časa.;Veliko časa bova preživela tu.
Kako kaj gre?;Kako gre?
Norm, upravitelj avatarja.;Norm, upravljavec avatarja.
Tukaj je soba za povezavo, tukaj se priključiš na avatarja... Z Normom bova upravljala ta daljinsko vodena telesa, avatarje.;Z Normom bova upravljala telesa, imenovana avatarji.
Vzgojili so jih iz človeške DNK pomešane z DNK domorodcev.;Vzgajajo jih iz kombinacije človeške in domorodne DNK.
Dobrodošla na Pandoro, lepo, da sta tukaj.;Lepo, da sta prišla.
Velika sta že.;Lepo, da sta prišla.
Izgleda, da zelo dobro napredujeta.;Lepo, da sta prišla.
Trajalo bo nekaj ur, da ju pripravimo, ampak jutri ju lahko vzameta ven.;Jutri ju lahko preizkusita.
Ta je tvoj.;Tamle je tvoj.
Podoben je bratu.;Podoben mu je.
Podoben je tebi.;Tebi je podoben.
Zdaj je to tvoj avatar, Jake.;To je zdaj tvoj avatar, Jake.
Koncept je tak, da je vsakemu upravljavcu prirejen njegov avatar.;Vsak upravljavec dobi svojega avatarja, da sta njuna živčna sistema usklajena.
Njun živčni sistem je usklajen.;To je več povezav kot v človeških možganih.
Ali nekaj podobnega... Delo so mi ponudili, ker se lahko povežem s Tommyjevim avatarjem.;To delo sem dobil, ker se lahko povežem s Tommyjevim.
Ta pa je izjemno drag.;Kar je verjetno veliko.
Je prav tako?;Je to res?
Ja, v navado nam je prešlo, da vse dokumentiramo.;Ja, dokumentirati moramo, kaj vidimo in čutimo.
Vse kar vidiš, vse kar čutiš, vse je del znanosti.;Bogastvo tega sveta ni v tleh, ampak vse okrog nas.
-Pa še pri pameti te bo ohranilo naslednjih šest let.;Pa še pri pameti te bo ohranilo prihodnjih šest let.
Saj vseeno.;Saj gre.
Zdaj sem torej tukaj.;Zdaj pa je čas, da se vrneš.
Ukvarjam se z znanostjo.;Skratka, tu sem in ukvarjam se z znanostjo.
Kdo ima moje presnete cigarete?;Kdo ima cigareto zame?
Ljudje, kaj je tukaj narobe?;Ljudje, kaj tu manjka?
Grace Augustine je legenda.;Peyral je dobra lovka.
Ona je vodja avatar programa, napisala je tudi knjigo.;Vodi avatarski program in napisala je knjigo o rastlinstvu na Pandori.
In to dobesedno, napisala je knjigo o rastlinstvu Pandore.;Vodi avatarski program in napisala je knjigo o rastlinstvu na Pandori.
To pa zato, ker ima raje rastline kot ljudi.;Ker ima rastline raje kot ljudi.
Norm, slišala sem nekaj dobrih stvari o tebi.;Lepe reči slišim o tebi.
Kako kaj tvoj Na'vi?;Poslušaj, kaj ti govori.
Dovolite mi, Velika mati, v čast mi je, da sem vas spoznal.;Moja naloga je, da vas ohranim žive.
Ni slabo, čeprav je nekoliko grobo.;Zenični refleks je dober.
Študiral sem pet let, ampak veliko še se moram naučiti.;Pet let se že učim, a se moram še veliko.
Grace, to je Jake Sully.;To je Jake Sully.
Vem, kdo si in ne potrebujem te.;Ne potrebujem tebe, ampak tvojega brata.
Potrebujem tvojega brata, saj veste, doktorja znanosti, ki je tri leta treniral za to nalogo...;Ne potrebujem tebe, ampak tvojega brata.
Koliko si delal v laboratoriju?;Koliko ur si opravil?
Nekoč sem seciral žabo.;Videl sem tvojo kartoteko.
Lulajo na nas pa niso niti toliko vljudni, da bi rekli, da dežuje.;Takole nam serjejo na glavo, pa se še opravičijo ne.
Grem k Selfridgu.;Pridita k očku.
To je navadno sranje.;To ni pošteno.
Zbrcala bom njegovo podjetniško rit.;Ogledala si bom tega tujca.
Nobene pravice nima, da bi vtikal nos v moj oddelek.;Naj se ne vtika v moj oddelek.
Pridi zjutraj ob osmih.;Jutri ob 8.00 bodi tu.
-Ja, gospod.;–Da, gospod.
Obožujem to palico, Ronnie.;Obožujem to palico.
