Hej!;Hej!;Hej!;Hej?
To lahko rečejo za vsakogar, kogarkoli.;To lahko rečejo čisto za vsakogar.;To počnejo tukaj.;Mislim, da jih imajo vsi.
Bistvo je, da bodo to rekli zate.;Ubil jo je dim, ne ogenj, in to je pomembno.;To lahko rečejo čisto za vsakogar.;To vem, ker sem tudi jaz tak.
Kako je s tvojo glavo?;Kako je s prividi?;Kako to mislite?;Kako je z vašo glavo?
Mojo glavo?;Z mojo glavo?;Čisto nič?;Sama v kuhinji, kot da to ne bi bilo nič takega?
-Kaj čudnih sanj zadnje čase?;-Imate zadnje čase čudne sanje?;-Kaj počnete tukaj?;-Ste bili cel večer na svojem mestu?
Težave s spanjem?;Težave s spanjem?;Solando med skupinsko terapijo karkoli rekla?;Vam nič ne pride na misel?
Kaj glavobolov?;Kaj?;Kaj?;Težave s spanjem?
-Jaz...;-Ah, ja, ...;-Ja.;-Ja.
Nagnjen sem k migrenam.;Nagnjen sem k migrenam.;Včasih, a danes sem bolj nagnjen k morski bolezni.;Spadava sem.
Da.;-Da.;-Da.;Ne.
-Kristus.;-Vem.;-Vem.;-Vem.
Saj nisi vzel kakšnih tablet, ne?;Saj ni zamere, ne?;Šel bom do svetilnika, me razumeš?;Da mi boš lahko še bolj lagal?
Mislim tudi samo aspirin?;Oprostite, imate mogoče aspirin?;Nisem pristaš zdravil, a v vašem primeru ... Kloro ... prom... kaj?;To ni izraz iz psihiatrije?
-Tudi aspirine mešajo?;-V aspirin podtikajo?;Oprostite, imate mogoče aspirin?;Težave s spanjem?
-Kristus.;-Vem.;-Vem.;-Vem.
In... si jedel hrano v restavraciji in pil kavo, s katero so ti postregli?;Kaj, če so te hoteli tu?;In jedli ste hrano v menzi, ter pili kavo, ki so vam jo dali.;Ljubi bog, si sploh še kdaj trezen?
Vsaj to mi povej, da si kadil samo svoje cigarete.;Povej mi po resnici.;Sem ti rekla, da ne hodi sem.;Da mi boš lahko še bolj lagal?
Ne... ne.;Ne, ne.;Ne.;Ne.
Ne, nisem.;Nisem.;Ne, sploh ne.;Nisem tega rekel.
36 do 48 ur je potrebnih, da nevroleptični narkotiki... dosežejo uporabni nivo v krvnem obtoku.;36 do 48 ur traja, da nevroleptični narkotik v krvi doseže primeren nivo.;Pacientu najprej dajo elektrošoke, nato pa mu skozi oko vstavijo šilo za led in ven povlečejo nekaj živčnih vlaken.;Nekateri pravijo, da postanejo pacienti razumni, pokorni, drugi pravijo, da jih spremeni v bebce.
Prvi znak je ohromelost.;Najprej pride do paralize.;Pacient je zelo inteligenten in močno blodnjav.;36 do 48 ur traja, da nevroleptični narkotik v krvi doseže primeren nivo.
Najprej v konicah prstov potem sčasoma cela roka.;Najprej prstne blazinice, sčasoma pa celotna roka.;Najprej pride do paralize.;Veste, kako bolečina vstopi v telo, šerif.
Se zadnje čase zbujaš s spalno paralizo, Marshal?;Ste kdaj videli taborišče smrti, doktor?;Ti je Noyce kaj povedal o razporeditvi?;Si bil kaj sam, odkar si prišel sem?
Kaj?;Kaj?;Kaj?;Kaj pa to?
Povej mi, kaj se dogaja v svetilniku?;Povejte mi, kaj se dogaja v svetilniku?;Šel bom do svetilnika, me razumeš?;Kaj, če pride do prekinitve električnega toka?
Povej mi.;Povej mi.;Ti mi povej.;Andrew, poslušaj me.
Operacije na možganih.;Operacije na možganih.;Posegi kot so transorbitalna lobotomija.;Z izvajanjem poskusov na možganih.
"Odprimo lobanjo in poglejmo, kaj se zgodi, če odstranimo ""to vrsto"".";Ugani, kaj so testirali.;Dajte jim tablete, jih posadite v kot in vse bo izginilo.;Naj dr. Sheehan pregleda vašega človeka, preden ga pošljete gor.
"To so pobrali od Nacistov: ""to vrsto"".";Teko kot se naučili od nacistov.;Nacisti so uporabili Žide, Sovieti zapornike v svojih gulagih.;To lahko rečejo čisto za vsakogar.
Tam ustvarjajo duhove.;Tu na ljudeh delajo poskuse.;To počnejo tukaj.;Govorijo, a nihče jih ne posluša.
Kdo ve za to?;Kdo ve za to?;Zakaj bi sploh kdo hotel?;Zakaj pa je to bilo kaj takega?
Mislim na otoku.;Na otoku mislim.;Na trajekt moraš.;Izginiva od tu.
Kdo?;Kdo?;Kdo?;Kdo je to?
Vsi.;Vsi.;-Vsi.;Sreča.
Daj no.;-Dajte no.;Daj no, šef.;Vidiš?
Medicinske sestre?;Možgane?;Zobne paste?;Ti pacienti?
Bolničarji?;Bolničarke, strežniki?;Še več pacientov?;Ti pacienti?
Ni mogoče, da bi vedeli... -Vsi.;-Ljubi bog, jaz ... -Brez skrbi.;Vsi.;Sedaj pa se vedeš kot ... -Kako?
Ne moreš ostati tukaj.;Ne moreš biti tukaj.;Ne moreš oditi.;Ne morete ostati tukaj.
Mislijo, da sem mrtva, da sem se utopila.;Mislijo, da sem utonila.;Bojim se, da me najdejo, če bodo iskali vas.;Žal mi je, da to slišim.
Bojim se, da bi lahko našli mene, če bi prišli iskat tebe.;Bojim se, da me najdejo, če bodo iskali vas.;Žal mi je, da to slišim.;Res si želim, da bi vas lahko pustil živeti v vašem izmišljenem svetu.
Oprosti, ampak oditi boš moral.;Prosim, ne počni tega, Teddy.;Ti si me zvlekel v to, šef.;Moraš me izpustiti.
Vrnil se bom pote.;Vrnil se bom po vas.;Vrnil sem se.;Ne bom odšel.
Ne bo me tukaj.;Ne bom odšel.;Nikoli ne bom prišel ven.;Nikoli ne bom prišla od tu.
Selim se podnevi.;Mimo mene.;Nočem oditi od tu.;Tule je.
Vsako noč na drugem mestu.;V primerjavi z ostalimi pacienti.;Tukaj je.;Tukaj je.
Ampak pomagal ti bom priti s tega otoka.;Laeddis ... Rekel si mi, da me boš osvobodil tega kraja.;Potem pa nikoli ne boš zapustil tega otoka.;George, spravil te bom od tu.
Me nisi niti malo poslušal, ko sem govorila?;Da mi boš lahko še bolj lagal?;Zakaj me nisi rešil?;Nadzoroval si me, kajne?
Edina pot z otoka je trajekt, oni pa ga nadzirajo.;Edina pot z otoka je trajekt in oni ga nadzorujejo.;Govorijo, a nihče jih ne posluša.;Ne morejo kar skočiti na trajekt, zbežati na kopno in povzročati težav.
Nikoli ne boš odšel od tod.;Potem pa nikoli ne boš zapustil tega otoka.;Če greš tja, boš umrl.;Nikoli ne bom prišel ven.
Jaz...;Ja.;Ja.;Ja.
Prijatelja sem imel.;Imel sem prijatelja.;Resnično mi je bil všeč.;Bil sem v Dachauu.
Včeraj sem bil z njim, a sva se ločila.;Včeraj sva bila skupaj, a potem sva se ločila.;Povedala mi je, a je nisem poslušal.;Poskušal sem, hotel sem, a ko sem prišel, je bilo že prepozno.
Si ga mogoče videla?;Si ga našel?;Ste ga videli?;Si bil kaj sam, odkar si prišel sem?
Marshal... Ti nimaš prijateljev.;Ti si me zvlekel v to, šef.;Nisem bil vzgojen za beg, doktor.;Zvezni šerif sem, zaboga.
Tukaj si.;Tukaj je.;Tukaj je.;Saj si doma.
Spraševali smo se že, kdaj se boš pojavil.;Spraševali smo se, kdaj se boste prikazali.;Bolj nas bega to, da ne vemo, kako je prišla iz svoje sobe.;Njegov dopust je bil načrtovan.
Prisedi.;Prisedite.;Ta implodira.;Pika.
Pridi.;Pridi.;Pridi!;Pridi!
Si si privoščil lagoden sprehod?;Ste šli na lagoden sprehod, kaj?;Si ga našel?;Kaj se ti je zgodilo?
Kaj?;Kaj?;Kaj?;Kaj pa to?
Bil sem... uh, samo... ogledoval sem si stvari.;Samo razgledoval sem se.;Ja, a videl nisem ničesar.;Jaz ... Mogoče sem šel na stranišče.
Ste uživali v poslednjem božjem daru?;Ste uživali v zadnjem Božjem darilu?;Verjamete v Boga, šerif?;Ste umorili svoje otroke?
V čem?;Od česa?;In v vašem?;Katerem partnerju?
-Božjem daru.;Ljubim te.;Ljubim te.;-Božje darilo.
Nasilje.;Nasilje.;Psihokirurgija.;Televizija.
Ko sem se spustil po stopnicah v svoji hiši in zagledal to drevo v dnevni sobi, se me je to dotaknilo, kot božja roka.;Ko sem v svoji hiši zagledal drevo, je seglo k meni kot božja roka.;Bila je tako prijazna, a v očeh sem ji lahko prebral, da bi se rada slekla.;Lahko jo je čutila, kako ji je udarjala po lobanji, jo za šalo vlekla za žičke.
Bog Ijubi nasilje.;Izginiva od tu.;Bog ti pomagaj.;Ne, prosim, bog ...
Jaz... tega nisem opazil.;Ja, a videl nisem ničesar.;Jaz sem bil le postranskega pomena.;Jaz ... Mogoče sem šel na stranišče.
-Prepričan sem, da ste.;-Seveda ste.;-Seveda ste.;-Natančno veste, kaj sem rekel.
Zakaj bi ga potem bilo toliko?;Zakaj bi ga sicer bilo tako veliko?;Zakaj bi sploh kdo hotel?;Zakaj bi to bilo pomembno?
V nas je.;V nas je.;Tukaj je.;Tukaj je.
To je tisto, kar smo.;Samo drug na drugega se lahko zaneseva.;To je drugače.;Ubil jo je dim, ne ogenj, in to je pomembno.
Spuščamo se v vojne, sežigamo žrtve, krademo in ropamo in prelivamo solze nad trupli naših bratov, in zakaj?;Zaboga, vojskovali smo se, da bi jih ustavili in sedaj izvem, da se to mogoče dogaja tu, na naši zemlji?;Zakaj bi sploh kdo hotel?;In zakaj?
Ker nam je Bog podaril nasilje, da se vojskujemo njemu v čast.;Ker nam je Bog dal nasilje, da se vojskujemo njemu na čast.;Vojskujemo se, žrtvujemo, plenimo, ropamo in morimo svoje brate.;Bogu je nasilje všeč.
Mislil sem, da nam je Bog podaril moralni red.;Mislil sem, da nam je Bog dal moralne zapovedi.;Nihče ne bi mogel priti ali oditi iz sobe, ne da bi ga jaz videl.;Če vam pustimo to odigrati, sem si mislil, boste lahko sprevideli, kako neresnično in nemogoče je to.
Noben moralni red ni tako nedolžen, kot to neurje.;Ni je jasnejše moralne zapovedi, kot je ta nevihta.;Karkoli že se tu dogaja, je zlo.;Mislil sem, da nam je Bog dal moralne zapovedi.
Nobenega moralnega reda ni.;Moralnih zapovedi sploh ni.;Karkoli že se tu dogaja, je zlo.;Ni je jasnejše moralne zapovedi, kot je ta nevihta.
Samo tole je: Lahko moje nasilje premaga tvoje?;Bogu je nasilje všeč.;Videli smo, kaj je človek sposoben narediti sočloveku, ne?;Resno, doktor, kako je mogoče, da resnica ne pride do nje?
Nisem nasilen.;Jaz nisem nasilen.;Nisem zato tukaj.;Tu nisem, da bi ubijal.
-Seveda ste.;-Seveda ste.;-Seveda ste.;-Seveda.
Nasilni ste toliko, kolikor lahko.;Vedete se, kot da je norost nalezljiva.;Pametnejši ste kot izgledate.;A ste nasilni, izurjeni in nevarni.
To vem, ker sem tudi jaz nasilen kolikor lahko.;To vem, ker sem tudi jaz tak.;Jaz nisem nasilen.;Žal mi je, da to slišim.
S silo družbe se povzdignemo in če bi bil jaz edina prepreka med tabo in hrano, bi mi s skalo razbil lobanjo in pojedel moje mesne koščke.;Nihče ne bi mogel priti ali oditi iz sobe, ne da bi ga jaz videl.;Družbeni pritiski so nas prisilili v razvoj, a če bi vam stal na poti do hrane, bi me ubili in pojedli.;Mislil sem, da nam je Bog dal moralne zapovedi.
Al ne bi?;Jasno?;Vidiš?;Razumeš?
Ampak Cawley misli, da si nedolžen, da te je lahko obvladovati, jaz pa vem, da ni tako.;Cawley misli, da ste neškodljivi in vodljivi, a jaz vem, da ni tako.;Če vam pustimo to odigrati, sem si mislil, boste lahko sprevideli, kako neresnično in nemogoče je to.;Nihče ne bi mogel priti ali oditi iz sobe, ne da bi ga jaz videl.
Ne poznaš me.;Moraš me izpustiti.;Sem ti rekla, da ne hodi sem.;Mislila sem nate.
-Oh, seveda te.;-Ja, seveda.;-Ja, gre.;-Tudi ti.
Ne, ne poznaš me.;Moraš me izpustiti.;Sem ti rekla, da ne hodi sem.;Mislila sem nate.
-Oh, seveda te.;-Ja, seveda.;-Ja, gre.;-Tudi ti.
Že stoletja se poznava.;Že stoletja se poznava.;Zmanjkuje nama časa.;Šele spoznala sva se, Chuck.
Če bi sedaj hotel zariti zobe v tvoje oko, bi me lahko ustavil, preden bi te oslepil?;Da mi boš lahko še bolj lagal?;Kaj naj ti rečem, da te ustavim?;Če bi vam zobe zasadil v oko, bi me lahko ustavili, preden vas oslepim?
Poskusi.;Pozabi jo.;Pozabi jo.;Pozabi jo.
Tako se govori.;Tako je.;Tako je.;To je igra.
Kje ste bili?;Kje ste bili?;Kje si bil?;Zakaj ste tu?
Oh, Samo... potepal sem se, ogledoval sem si vaš otok.;Pozabil sem, da odhajate, sedaj ko smo Rachel našli.;Odšla bova s tega prekletega otoka.;Izvedel bom, kaj se dogaja na tem otoku.
Oh, pozabil sem.;Prenehal sem.;Nisem opazil.;Nisem opazil.
Odhajate.;Sprehodite se.;Prišli ste sami.;Tukaj ste.
Zdaj ko smo našli Rachel.;Zjutraj sva govorila o sporočilu Rachel Solando ... Zakon štirih.;Pozabil sem, da odhajate, sedaj ko smo Rachel našli.;Ampak ona je tu.
Seveda.;Seveda, ja.;Zelo.;Ja, verjamem.
Ja.;Ja.;Ja.;Ja.
Pomemben sestanek?;Pomemben sestanek?;Je kdo tam?;Ste ga videli?
-Oh, da.;-Dobro.;-Dobro.;-Ne, ne.
Očitno je bil včeraj na oddelku C neznan moški.;Kaže, da je bil včeraj na oddelku C neznan moški.;Izvedeli so, da se je strežnik znesel nad pacientom.;Stražniki so ga že preiskali.
Obvladal je zelo nevarnega pacienta, zelo spretno.;Spretno je ukrotil zelo nevarnega pacienta.;Eno uro je trajalo, da je umrl.;Pacientka je pobegnila, bil je popoln izgovor.
A res?;Kaj pa to?;Kdo ve za to?;Ni tako?
Zgleda, da je imel dolg pogovor s paranoidnim shizofrenikom, Georgom Noycem.;Dolgo se je pogovarjal s paranoidnim shizofrenikom, Georgeom Noycem.;Rekel je, da so mu glasovi tako naročili.;Mogoče Cawley sedi v svoji graščini in premišljuje o svojem obnašanju.
Ne spomnim se, kaj sem rekla.;Tega se ne spomnim.;Nisem prepričana, da bi sploh smela.;Žal mi je, da to slišim.
Ne spomnim se... -Pomirite jo.;Tista bolničarka ... -Prosim, nehajte.;-Ljubi bog, jaz ... -Brez skrbi.;-Če ste kaj naredili mojemu partnerju, je to kršitev ... -Zberite se, Andrew.
To je Noyce, rekli ste, da mu je tako ime.;Vi ste dali Noycea pretepsti.;To je Mahler.;Ime mi je Edward Daniels.
On je... motena oseba?;Kaj pa moj partner?;Kaj pa mož?;To ni izraz iz psihiatrije?
-Oh, zelo.;-Ja, seveda.;-Ja, gre.;-Seveda.
Lahko se precej razburi.;Lahko bi zašel v težave.;Biti zna precej neprijeten.;To verjetno ni dobro.
Pravzaprav, pred dvema tednoma se je pacient tako vživel... v eno od Noycevih zgodb, da ga je ta pretepel.;Pred dvema tednoma se je neki pacient tako razburil zaradi neke Noyceve zgodbe, da ga je pretepel.;Vse to zaradi dr. Cawleyja.;Dokler nisem našel nekoga, ki je bil tu pacient.
Hm... -Cigareto?;-Legendarnemu?;-Odvajanje?;Veste?
Oh... Ne, hvala.;Ne, hvala.;Ne, ne.;Ne, prosim, bog ...
Nehal sem kaditi.;Nisem imel deklice.;Dovolj sem ubijal.;Nikoli ne bom prišel ven.
Torej, greste na trajekt?;Torej, boste odšli s trajektom?;Ste šli na lagoden sprehod, kaj?;Ste ga videli?
Da, seveda.;Seveda, ja.;Zelo.;Ja, verjamem.
Jaz...;Ja.;Ja.;Ja.
Mislim, da sva zaključila s svojim delom tukaj, torej.;To bova morala obdržati.;Če bi šlo le za ljudi s prisluhi, naju verjetno ne bi potrebovali.;Mislim, da boste to morali vprašati njega.
"""Sva"", Marshal?";-Legendarnemu?;Veste?;Ja, sva, ni tako?
Če smo že pri tem.;Ko smo že pri tem ...;Ko sva že pri tem ...;In, kako ji že rečejo ...
Ste ga videli, doktor?;Ste ga videli, doktor?;Ne, kakšna je ta dobra novica, doktor?;Ste ga videli?
-Koga?;-Koga?;-Mene?;-Jaz?
Mojega partnerja, Chucka.;Mojega partnerja, Chucka.;Moja hčerka.;Jaz sem ga.
Vi nimate partnerja, Marshal.;Nimate partnerja, šerif.;Nisem bil vzgojen za beg, doktor.;Ne bom vas ubil.
Sami ste prišli sem.;Prišli ste sami.;Tukaj ste.;Torej ste bili poleg.
Veste, nekaj vrednega sem zgradil tukaj, in za vredne stvari ni razumevanja v času, ko nastajajo.;Če nam pri tebi spodleti, potem bo vse, kar smo tu poskušali narediti, izgubilo veljavo.;Pravijo, da nikoli ne bom odšel od tu.;Ljudje kot ste vi, so moja specialnost.
Vsi zahtevajo takojšnji popravek, zmeraj so ga.;To lahko rečejo čisto za vsakogar.;Zapliniti bi jih morali.;Pravijo, da sem sedaj njihov.
Poskušam narediti nekaj, kar Ijudje vključno z vami ne razumejo.;Poskušam narediti nekaj, česar ljudje, tudi vi, ne razumejo.;A vaši prividi so hujši, kot sem predvideval.;Bojim se, da me najdejo, če bodo iskali vas.
Jaz pa se ne bom predal brez borbe.;In ne bom se predal brez boja.;Rečem lahko le, da bom videl, kaj lahko storim.;Mogoče bo bolje, da tokrat ne greš zraven.
To sem opazil.;To mi je bilo zelo všeč.;Resnično mi je bil všeč.;Presenečen sem.
Torej še enkrat mi povejte o svojem partnerju.;Povejte mi še enkrat o tem partnerju.;Povejte mi kaj o njem.;Če vzpostavite linijo, me poiščite.
Kakšnem partnerju?;Katerem partnerju?;Bolničarke, strežniki?;Z mojo glavo?
Marshal... Vi... greste kam?;Saj razumete, ... ... da vam ne morejo dovoliti, da odidete?;Moja pištola ... Kaj ste naredili z mojo pištolo?;Šerif, ste tukaj?
Ne, jaz samo... namenjen sem proti trajektu.;Morava nazaj noter.;Gospod, ničesar nisem videl.;Do svetilnika grem.
Torej... -Oh, bojim se...;Tista bolničarka ... -Prosim, nehajte.;-Ljubi bog, jaz ... -Brez skrbi.;-Ne, ne, ... -In če rečem, da nisem nora ...
Bojim se, da greste v napačno smer.;Bojim se, da je v drugo smer.;Vaše taktike na meni ne bodo delovale.;A vaši prividi so hujši, kot sem predvideval.
Če počakate trenutek, bom... našel nekoga, ki vas bo pospremil do pomola.;Če počakate, bom poiskal koga, ki vas lahko odpelje do doka.;Ampak lahko bi vas odpeljal z otoka.;Izvedel bom, kaj se dogaja na tem otoku.
Kaj je to, doktor?;Kaj je to, doktor?;Kaj je to?;Kaj se tu dogaja, jebenti?
Kaj je to?;Kaj je to?;Kaj je tam?;Kaj je to, doktor?
-To je samo pomirjevalo.;-Samo pomirjevalo.;-To je čar vsega tega.;-Ne, ni odvisno od 'mesa'.
Samo previdnostni ukrep.;Previdnostni ukrep.;Brez zamer.;To je vse.
-Oh, previdnostni ukrep?;-Nikoli prej nisi delal z njim, ne?;-Kaj res?;-Kaj, hudiča, misliš s tem?
Kaj... kaj boste storili?;Kaj boste naredili?;Kaj boš naredil?;Moja pištola ... Kaj ste naredili z mojo pištolo?
Me boste ubili?;Me boste ubili?;Si ubila svoje otroke?;Moja pištola ... Kaj ste naredili z mojo pištolo?
Marshal.;Sam.;Šerif.;Šerif.
Mislite, da si zaslužite?;Vam nič ne pride na misel?;Razumete?;Kako to mislite?
Zaradi česa?;Od česa?;Zakaj?;Zakaj?
Ker sem vas sprovociral?;Vam nič ne pride na misel?;Vi ste stražili na stopniščnem podestu, ni tako?;Zadnji dve leti mi je v Bostonu nekdo podtikal zdravila?
In oprostite, kaj pa vas ne provocira?;Kaj je pa potem tole, jebenti?;Saj ni zamere, ne?;Ko me je poslala po vodo, vam je nekaj rekla, kajne?
Opazke...;Privolite, ali pa ...;Šerif ...;Ne, prosim, bog ...
Besede.;Opazke, besede.;Brezvestno.;Ali sočutja.
-Nacisti.;-Nacisti.;-Vojna.;-Bedarija!
No, to tudi.;Seveda, ja.;To je vse.;Je že v redu.
In seveda spomini, sanje...;In seveda spomini, sanje ...;In, kako ji že rečejo ...;In nato ...
"Ste vedeli, da beseda ""travma"" izhaja iz grške besede za ""rano""?";"Ste vedeli, da beseda travma izhaja iz grške besede za ""rana""?";Ste v zadnjem času videli kakšno živo grozo, šerif?;Menite, da gre le za naključne čačke?
"In kaj je nemška beseda za ""sanje"".";In kako se v nemščini reče sanjam?;In kaj naj bi to bilo?;In, kako ji že rečejo ...
"""Traum"".";"""Traum"".";Svetilnik.;- Klorpromazin.
"""Ein Traum"".";"""Traum"".";"""Ein Traum.""";-Klorpromazin.
Rane lahko ustvarijo pošasti.;Rane lahko ustvarijo pošasti.;Če bodo priklenjeni k tlom, bodo umrli.;Pravijo, da imamo bombe, ki lahko cela mesta spremenijo v pepel.
In vi... vi ste ranjeni, Marshal.;In vi, vi ste ranjeni, šerif.;Ker vam je rekel Laeddis, vi pa bi naredili vse, da ne bi bili on.;Cawley misli, da ste neškodljivi in vodljivi, a jaz vem, da ni tako.
Ali se ne strinjate, da ko vidiš pošast, jo moraš zaustaviti.;Saj razumete, ... ... da vam ne morejo dovoliti, da odidete?;Cawley misli, da ste neškodljivi in vodljivi, a jaz vem, da ni tako.;Ko vidiš pošast, jo moraš ustaviti, se strinjate?
Ja... Strinjam se.;To je točno, ja.;Resno mislim.;Tako je.
-Da... Kaj delaš, Ijubček?;-Ja ... Kaj delaš, dragi?;-Kaj, hudiča, misliš s tem?;-In misliš, da se to dogaja tu?
Na trajekt moraš.;Na trajekt moraš.;Na otoku mislim.;Ne moreva ravno oditi s trajektom.
-Ne.;-Ne.;-Ne.;-Ne.
Ne, ne.;Ne, ne.;Ne, hvala.;Ne.
Če cel svet misli, da je Chuck mrtev, potem je idealen za njihove poskuse.;Če svet misli, da je Chuck mrtev, je popoln za njihove poskuse.;Cawley misli, da ste neškodljivi in vodljivi, a jaz vem, da ni tako.;Če vam pustimo to odigrati, sem si mislil, boste lahko sprevideli, kako neresnično in nemogoče je to.
Samo eno mesto obstaja, kamor bi ga odpeljali.;Samo en kraj je, kamor bi ga odpeljali.;Samo en kraj je, kjer ga nihče ne bi opazil.;Tu je veliko krajev, kamor lahko skriješ truplo.
Če greš tja boš umrl.;Če greš tja, boš umrl.;Potem pa nikoli ne boš zapustil tega otoka.;Ta kraj te bo pokopal.
-Moj partner je.;-Držim ga.;-To je otok.;-Ime mi je Edward Daniels.
Če ga mučijo, če imajo zaprtega proti njegovi volji, mu moram pomagati.;Če ga zadržujejo proti njegovi volji, moram to razkriti.;Moral bi me rešiti.;Nihče ne bi mogel priti ali oditi iz sobe, ne da bi ga jaz videl.
Nikogar več ne smem izgubiti.;Nikogar več ne morem izgubiti.;Nikoli ne bom prišla od tu.;In ne bom se predal brez boja.
Ne odhajaj tja Teddy, prosim.;Prosim, ne počni tega, Teddy.;Zbeži stran, Teddy.;S tabo grem, šef.
Prosim, ne delaj tega.;Prosim, prenehaj govoriti.;Prosim, ne počni tega, Teddy.;Prosim, nehajte!
Ne odhajaj tja.;Ne hodi tja.;Ne hodi.;Pozabi jo.
Oprosti Ijubica.;Žal mi je, ljubica.;Oprostite.;Bog ti pomagaj.
To stvar imam rad zato, ker si mi jo ti dala.;Všeč mi je, ker si mi jo ti dala, a resnica je, da je to ena presneto grda kravata.;Ker vem, kako zelo jo potrebuješ.;To vem, ker sem tudi jaz tak.
Res pa je, da je to samo ena pofukano grda kravata.;Všeč mi je, ker si mi jo ti dala, a resnica je, da je to ena presneto grda kravata.;Zdi se, da bi to človek sem in tja opazil.;To lahko rečejo čisto za vsakogar.
Ne!;Ne!;Ne!;Ne!
Ne premikaj se!;Ne premikajte se!;Pozabi jo.;Pozabi jo.
Ostani kjer si!;Pokaži mi že svoj obraz!;Tu sem zaradi tebe!;Ostanite na mestu!
Me boš... me boš ubil?;Kaj naj ti rečem, da te ustavim?;Zakaj me nisi rešil?;Da mi boš lahko še bolj lagal?
Ne, ne bom te ubil.;Ne bom vas ubil.;Moraš me izpustiti.;Ne bom odšel.
Zakaj si vsa mokra, punči?;Zakaj si vsa mokra, ljubica?;Zakaj si ves moker, ljubček?;Ljubica ... Zakaj si vsa mokra?
Kaj ste rekli?;Kaj ste rekli?;Kaj vidite?;Kako to mislite?
-Saj veste, kaj sem rekel.;-Natančno veste, kaj sem rekel.;-Ja, takoj se vam bom posvetil.;-Prav imate, šerif.
Mimogrede, puška je prazna.;Mimogrede, puška ni nabita.;Videti je kot nekdanja vojaška rit.;Niti sledu ni.
Sedite prosim.;Povejte mi.;Andrew, prosim, nikar.;Kar izvolite.
Za božjo voljo posušite se, še prehladili se boste.;Zaboga, posušite se, saj se boste še prehladili.;Sploh je ne omenjajte!;Prenehajte s tem!
Dobro.;Dobro.;Dobro.;Dobro.
Kako hudo ste poškodovali stražarja?;Kako močno ste poškodovali stražarja?;Kaj se vam je zgodilo?;Ste v preteklosti doživeli kakšen duševni pretres?
Jaz... Ne vem, o čem govorite.;Ne vem, o čem govorite.;Oprostite, gospa, ne vem, o čem govorite.;Ne boste me jebali v glavo.
Da.;-Da.;-Da.;Ne.
Tukaj je.;Tukaj je.;Tukaj je.;Ja, tukaj je.
Naj Dr. Sheehan dobro pregleda vaše fante, preden ga pošIjete gor.;Naj dr. Sheehan pregleda vašega človeka, preden ga pošljete gor.;Opravili smo s formalnostmi, sedaj pa poiščimo dr. Cawleyja.;Žal vas bo s situacijo moral seznaniti dr. Cawley.
Torej je dr. Shehan prišel danes zjutraj s trajektom.;Torej je dr. Sheehan prišel z jutranjim trajektom.;Odšel je z jutranjim trajektom.;Odšla bova z jutranjim trajektom.
Ne ravno.;Ne prav veliko.;Ne, sploh ne.;Seveda, ja.
Raznesli ste moj avto.;Razstrelili ste mi avto.;Šli ste za mano, doktor.;Rekel sem, da ste ljudje nasilja.
Res sem imel rad ta avto.;Resnično mi je bil všeč.;To mi je bilo zelo všeč.;Imel sem prijatelja.
Žal mi je za to.;Žal mi je.;Ne, žal mi je.;Žal mi je, ljubica.
Drgetanje postaja vedno hujše, je tako?;Ste šli na lagoden sprehod, kaj?;Lahko prenehajte s tem?;Kako je z vašo glavo?
Kako je s halucinacijami?;Kako je s prividi?;Kako to mislite?;Šerif, imate migreno?
Pojdi ven od tod, Teddy.;Zbeži stran, Teddy.;Povej mu, Teddy.;S tabo grem, šef.
Ta kraj te bo pokončal.;Ta kraj te bo pokopal.;Če greš tja, boš umrl.;Najdi ga in ga ubij.
Ni slabo.;Je že v redu.;Brez zamer.;Enostavno je najboljše.
-Vedno huje bo.;-Pomagajte mi.;-Nočem jih.;-Ne morem se pritoževati.
-Vem.;-Vem.;-Vem.;-Vem.
Dr. Solando... povedala mi je za neuroleptike.;Dr. Solando mi je povedala za nevroleptike.;Bila je na skupinski terapiji.;Po tem, ko se je prvič poskušala ubiti, mi je Dolores povedala, da ima žuželko, ki živi v njenih možganih.
Dajte no, res?;Kaj pa to?;Kaj se tu dogaja, jebenti?;Andrew, kaj vidite?
In kdaj je bilo to?;Kdaj pa?;Zakaj pa je to bilo kaj takega?;Kdaj je ta zapornica pobegnila?
-Doktorico sem našel v jami ob pečinah, ampak... nikdar je ne boste našli.;-Čez čeri sem plezal, da bi te rešil.;-Vem le, da gre za umobolnico.;-Pozneje bom pogledal, to je vse.
Ne dvomim v to.;Ne, to ni mogoče.;To verjetno ni dobro.;Bojim se, da je v drugo smer.
Glede na to, da ni resnična.;O tem ne dvomim, glede na to, da ni resnična.;Žal mi je, da to slišim.;Moja teorija je taka, Andrew.
Vaše halucinacije so precej resnejše, kot smo mislili.;Vaše taktike na meni ne bodo delovale.;Vedete se, kot da je norost nalezljiva.;Imate odlične obrambne mehanizme.
Niste na neuroleptikih.;Šerif ste.;Ne, vi ne.;Nadvse ste nasilni.
Na ničemer niste, če smo bolj natančni.;A nekako še niste našli časa, da bi to pogledali.;A ste nasilni, izurjeni in nevarni.;Pravzaprav ne jemljete ničesar.
Kaj za vraga je potem to?;Kaj je pa potem tole, jebenti?;Kaj pa to?;Kaj se tu dogaja, jebenti?
Ha?;Vidiš?;Veste?;Dobro!
Kaj za vraga je to?;Kaj je to, doktor?;Kaj je to?;Kaj pa to?
Odrekanje.;Nasilje.;Psihokirurgija.;Bedarija.
Odre...;Šerif ...;Privolite, ali pa ...;On je ...
Odrekanje?;Cigareto?;Šerif?;Šef?
Od... od... od česa?;Od česa?;Ja, sva, ni tako?;Veste?
Niti preklete pijače nisem spil, odkar sem na tem otoku.;Odkar sem na tem otoku nisem spil niti kapljice.;Nikoli ne bom prišel ven.;Pravijo, da nikoli ne bom odšel od tu.
Chlorpromazine.;Pot noter.;-Klorpromazin.;- Klorpromazin.
Nisem ravno navdušenec farmakologije a v vašem primeru moram reči... Clorpro... clorproma... kaj?;Nisem pristaš zdravil, a v vašem primeru ... Kloro ... prom... kaj?;Ko me je poslala po vodo, vam je nekaj rekla, kajne?;Oprostite, doktor ... Kaj med čem in čem?
-Chlorpromazine.;-Klorpromazin.;- Klorpromazin.;-Dehidracija.
Isto zdravilo, ki ti ga dajemo zadnjih 24 mesecev.;Isto zdravilo, ki smo vam ga dajali zadnjih 24 mesecev.;Nisem pristaš zdravil, a v vašem primeru ... Kloro ... prom... kaj?;Ne moreš se kar odločiti, da boš ozdravel.
Torej v zadnjih dveh letih... mi... mi je nekdo skrivaj dajal zdravila v Bostonu.;Dokler nisem našel nekoga, ki je bil tu pacient.;Če bi bila to moja žena, bi ga ubil ... dvakrat.;Vse to zaradi dr. Cawleyja.
To pravite?;Vam nič ne pride na misel?;Zakaj ste tu?;To ni izraz iz psihiatrije?
