Hej!;Hej!;Hej!;Hej?
In njegova mati?;In njegova mati?;In nato videla svojo družino v Koloseju?;Kdo?
Naj delita usodo njenega ljubimca?;Naj delita usodo njenega ljubimca?;Jo je ugriznila v prsi?;Bosta vidva v senatu javno obtožila mojega brata?
Naj bom mar usmiljen?;Ali naj bom sočuten?;Kaj pa bi rad verjel?;Ali nisem sočuten?
Komod Usmiljeni.;Komod Sočutni.;Vstani.;Vstani.
Lucij bo ostal z mano.;Lucij bo zdaj ostal z menoj.;Ostani z menoj nocoj.;Čas je, da grem.
In če me bo njegova mati samo narobe pogledala, bo umrl.;In če me njegova mati zgolj pogleda na način, ki mi ni po godu, bo umrl.;Ampak umrl bom kmalu.;In maščeval se bom za to, naj bo v tem ali naslednjem življenju.
Če se odloči biti plemenita in si vzeti življenje, bo umrl.;Če se odloči biti plemenita in si vzeti življenje, bo umrl.;Umoril je človeka, ki te je osvobodil.;Prinesel jim bo smrt, in zato ga bodo ljubili.
Glede tebe pa...;Kar pa se tiče tebe ...;Kar pa se tiče mene ...;Vidiš?
Ljubila me boš, kot sem jaz tebe.;Ljubila me boš, kot sem jaz tebe.;In ker sem te jaz imela rada.;On te bo našel.
Rodila mi boš čistokrvnega dediča, da bodo Komod in njegovi potomci vladali 1000 let.;Rodila mi boš čistokrvnega dediča, da bodo Komod in njegovi potomci vladali 1000 let.;Žrtvoval bom 100 bikov, da bom počastil tvojo zmago.;Ljubila me boš, kot sem jaz tebe.
Mar nisem usmiljen?;Ali nisem sočuten?;Ali naj bom sočuten?;Ali misliš, da sem brezsrčna?
Nisem usmiljen?;Ali nisem sočuten?;Sem zamudil bitko?;Ali nisem sočuten?!
Maksim!;Maksim!;Maksim!;Maksim!
Vojščak sem.;Vojščak sem.;Pisar sem.;Gladiator sem.
Ubogam ukaze.;Ubogam ukaze.;To mi ne da spati.;Veš, da te ljubim.
Nikomur se ne zgodi nič, česar po naravi ni sposoben prenesti.;Nikomur se ne zgodi nič, česar po naravi ni sposoben prenesti.;Tako trdno spi, ker je ljubljen.;Na smrtni postelji želi človek vedeti, da je imelo njegovo življenje smisel.
Maksim.;Maksim.;Maksim.;Maksim.
Maksim.;Maksim.;Maksim.;Maksim.
Kličejo te.;Kličejo te.;Poklekni.;Vse do tebe.
Generala, ki je postal suženj.;General, ki je postal suženj.;Gladiator, ki se je zoperstavil cesarju.;Umoril je človeka, ki te je osvobodil.
Sužnja, ki je postal gladiator.;Suženj, ki je postal gladiator.;General, ki je postal suženj.;Gladiator, ki se je zoperstavil cesarju.
Gladiatorja, ki se je uprl cesarju.;Gladiator, ki se je zoperstavil cesarju.;General, ki je postal suženj.;Suženj, ki je postal gladiator.
Osupljiva zgodba.;Osupljiva zgodba.;Grozljive sanje so ...;Močna kombinacija.
Zdaj želijo vedeti, kako se konča.;Zdaj ljudje želijo vedeti, kako se konča.;Nasprotujejo mu, pa vendar ne storijo nič.;Ne želijo se predati.
Dovolj bo le sijajna smrt.;Pritiče ji le sijajna smrt.;Njegov čas bo že prišel.;Če se odloči biti plemenita in si vzeti življenje, bo umrl.
In kaj bi lahko bilo sijajnejšega kot izzvati samega cesarja v veliki areni?;In kaj bi lahko bilo bolj sijajnega kot izzvati samega cesarja v veliki areni?;Potem bi nas lahko cesar podučil, glede na njegove bogate izkušnje.;In kaj je Rim, Maksim?
Bi se boril proti meni?;Bi se boril z menoj?;Ali nisem sočuten?;Če uredim, bi se srečal z njim?
-Zakaj pa ne?;-Zakaj pa ne?;-Kaj ne razumeš?;-Mogoče, ampak kaj za to?
Misliš, da se bojim?;Misliš, da se bojim?;Misliš, da to drži?;Vidiš?
Mislim, da se bojiš že vse življenje.;Mislim, da se bojiš že vse življenje.;To veš že od otroštva.;Preprosto nočeš umreti.
V nasprotju z neustrašnim in nepremagljivim Maksimom?;-V nasprotju z neustrašnim in nepremagljivim Maksimom?;Ni prepozno, da bi se igral legionarja?;Je Rim vreden življenja enega dobrega moža?
"Poznal sem moža, ki je rekel: ""Smrt se smehlja vsem nam.";"Poznal sem moža, ki je rekel: ""Smrt se smehlja vsem nam.";Vi pa ... Ostanite živi, sicer bom jaz umrl.;V uho ti bo zlil meden napoj in ko se boš nekega dne zbudil, boš govoril le: Republika!
Ostane nam samo, da se ji smehljamo tudi mi.;Ob tem se zabavam, kajti modri, vsevedni Mark Avrelij je bil tisti, ki nas je pregnal.;Konec koncev smo vsi mrtvi možje.;In smo potuhnjeni.
Sprašujem se, ali se je tvoj prijatelj smehljal, ko je umrl.;Sprašujem se, če se je tvoj prijatelj smehljal, ko je umrl.;Menda je tvoj sin cvilil kot dekle, ko so ga pribili na križ.;Je res tako hudo, da me znova vidiš?
Ti gotovo veš.;Ti gotovo veš.;Lahko barantam.;Saj vidiš to.
Bil je tvoj oče.;Tvoj oče je bil.;Rad si imel mojega očeta, vem.;Moj oče je zdaj naklonjen tebi.
Rad si imel mojega očeta, vem.;Rad si imel mojega očeta, vem.;Moj oče je zdaj naklonjen tebi.;Tvoj oče je bil.
Toda tudi sam sem ga.;Toda tudi sam sem ga imel.;Tudi jaz sem bral.;Pa sem te.
Zatorej sva brata, mar ne?;Zatorej sva brata, mar ne?;To je srž težave, mar ne?;Konec koncev smo vsi mrtvi možje.
Nasmehni se mi, brat.;Pojdi k materi, Lucij.;Pridruži se nama, sestra.;Dovoli, da ti pomagam.
Nadeni mu oklep.;In prinesi starcu še eno odejo.;Odpri usta.;Pritrdi mu oklep.
Pokrij rano.;Zakrij rano.;Pojdi k njima.;Umaknite se.
Maksim!;Maksim!;Maksim!;Maksim!
Maksim!;Maksim!;Maksim!;Maksim!
V krog!;Štiri!;Nizko pri tleh!;Hitro!
Kvint, meč.;Kvint, meč.;Kvint.;Kvint.
Daj mi svoj meč.;Daj mi svoj meč.;Poslušaj me.;Dajem ti besedo.
Meč!;Meč!;Štiri!;Stražar!
Dajte mi meč!;Dajte mi meč!;Napnite loke!;-Najdite me!
Pospravite meče.;Pripravite se na streljanje.;Pripravite katapulte.;Spustite orožje.
Maksim.;Maksim.;Maksim.;Maksim.
Maksim.;Maksim.;Maksim.;Maksim.
-Kvint.;-Bil.;-Domov.;-Domov.
Osvobodi moje može.;Osvobodi moje može.;Uči se od mene.;Naj vidim tvoj obraz.
Senator Grah naj spet zasede položaj.;Senator Grakh bo spet prišel na položaj.;Naroči, naj sledijo vsakemu senatorju.;-Maksim, dokler senat ne bo nared, da znova zavlada.
Nekoč so bile sanje.;Nekoč so bile sanje Rim.;Nekoč so bile sanje Rim.;Grozljive sanje so ...
Rim.;Juba.;Navade.;Sedi.
Uresničile se bodo.;Uresničile se bodo.;Njegov čas bo že prišel.;Ne bo uspelo.
To so želje Marka Avrelija.;To so želje Marka Avrelija.;To je dovolj.;Za katerega se je vredno boriti.
Osvobodite jetnike!;Napnite loke!;Ustavite se!;Umrite!
Gremo!;Gremo!;Gremo!;Gremo!
Maksim!;Maksim!;Maksim!;Maksim!
Lucij je na varnem.;Očiščena je.;Lucila je tukaj.;Gaja to ne vpliva.
Pojdi k njima.;Pojdi k njima.;Pojdi k materi, Lucij.;Zakrij rano.
Doma si.;Doma si.;Tukaj je.;Zamudil si vojno.
Je Rim vreden življenja enega dobrega moža?;Je Rim vreden življenja enega dobrega moža?;Kako naj nagradim največjega rimskega generala?;Ali je bil Herkul?
Nekoč smo to že verjeli.;Nekoč smo že verjeli tako.;Vsi to pravijo, dokler niso tam zunaj.;Prihodnost bo to plačala.
Poskrbi, da bomo spet.;Obljubi, da boš poskrbel za mojo družino.;Ostani z menoj nocoj.;Tega imej.
Bil je rimski vojak.;Bil je rimski vojščak.;Ta mož je dobro služil Rimu.;Poveljnik severnih vojska, general Feliksovih legij, vdani služabnik pravega cesarja, Marka Avrelija.
Izkažite mu čast.;Bodite blizu.;Bodite blizu.;Počastite ga.
-Kdo mi ga bo pomagal nesti?;-Kdo mi ga bo pomagal nesti?;-In kdo bo to plačal?;-Zakaj bi si jaz tega želel?
Zdaj sva svobodna.;Zdaj sva svobodna.;Ne smeva več čakati.;Pretvarjajva se, da si ljubeča hči, jaz pa dober oče.
Spet se bova srečala.;Spet se bova videla.;Čas je, da grem.;Še ju boš videl.
Toda ne še.;Ampak ne še.;Ampak ne še.;Ne še.
Ne še.;Ne še.;Ne še.;Ne še.
MEDIATRANSLATIONS Prevod za Extended Edition: Tagasalin;Režija Prevod in priredba: Tagasalin;Kraljica se je ubila s kačo.;-Komod.
"""ZLOVEŠČI OTOK"" ""Pristaniški otoki Bostona"" Zberi se Teddy!";Zbeži stran, Teddy.;Pridi, Chuck!;Kje si, Chuck!
Zberi se!;Zberi se!;Pridi!;Pridi!
Saj je samo voda.;Saj je samo voda.;Saj si doma.;Naj me vrag, če vem!
Ogromno vode je.;Veliko vode.;Tule je.;Razvalina je.
Daj no.;-Dajte no.;Daj no, šef.;Vidiš?
Je vse v redu šef?;Je kdo tam?;Kaj je narobe, šef?;Kaj pa mož?
-Ja, v redu sem.;-Ja, v redu sem.;-Ja, bojim se, da res.;-V redu bom.
Samo... uh... Samo ne... prenašam dobro vode.;-Ja, samo ... Ne prenesem vode.;Veš, ta kraj mi daje misliti.;Ne, prosim, moram te držati.
Ti si torej moj novi partner?;Tvoj partner sem, zaboga!;Nadzoroval si me, kajne?;Zakaj me nisi rešil?
-Tako je.;-Tako je.;-Točno!;-Držim ga.
Ni ravno najboljši način za spoznavanje, kadar sem z glavo napol v stranišču.;Z glavo v školjki res ne narediš dobrega vtisa.;Običajno ni ravno nekaj, s čimer se tu srečujemo.;Kar jaz počnem, ni ravno po pravilih.
"Ni ravno v skladu Teddyem Danielsom: ""Človekom -Legendo"".";Res ni ravno podobno legendarnemu Teddyju Danielsu.;Prav tako Rachel Solando, če smo že pri tem.;"Ne, ne, piše,  da ""gre zame IN za Laeddisa""."
To ti priznam.;To je točno, ja.;Resno mislim.;Vidim.
Legendo?;Si našel Laeddisa?;Laeddis!?;Laeddis?
Kaj za vraga kadite vi fantje iz Portlanda?;Kaj, hudiča, kadite vi v Portlandu?;Kaj se tu dogaja, jebenti?;Kaj vidite?
Iz Seattla.;-Šerif Aule.;Vodil je seanso.;In za Laeddisa.
Prihajam iz oddelka v Seattlu.;Prihajam iz urada v Seatlu.;Iz Seattla sem.;Policist sem.
Koliko časa si že pri Marshalih (Zvezni policiji, op. p.)?;Kako dolgo si že zvezni šerif?;So ti dali kakšne napotke?;Čakal si na priložnost, da prideš sem, potem pa so nenadoma potrebovali šerifa?
Štiri leta.;Brezvestno.;Ti in jaz.;Vlekla kurca.
Potem veš, kako malo je to?;Lahko živiš s tem?;Kaj pa to?;Kaj, če so te hoteli tu?
Seveda.;Seveda, ja.;Zelo.;Ja, verjamem.
Kaj pa ti?;Kaj pa ti?;Vidiš?;Kaj počneš?
Imaš dekle?;Imaš dekle?;Ti je všeč?;Si ga našel?
Poročen?;Z mojo glavo?;Cigareto?;Pomemben sestanek?
Bil sem.;Jaz sem ga.;Imel sem prijatelja.;Prenehal sem.
Umrla je.;Umrla je.;Mrtva je.;Napisala je.
Oprosti... Jaz... nisem... -Je že v redu.;-Ljubi bog, jaz ... -Brez skrbi.;Mogoče bo zjutraj ... -Si blefiral?;-Ne, ne, ... -In če rečem, da nisem nora ...
Medtem ko sem bil v službi je izbruhnil požar v stanovanju Štirje Ijudje so umrli.;Bil sem v službi, ko je stavbo zajel požar.;Andrew Laeddis je prižgal vžigalico, ki je povzročila požar, zaradi katerega je umrla moja žena.;Ko sem šel ven, sem na tleh videl trupla.
Dim jo je pokončal, ne ogenj.;Izginil je, kot da nikdar ne bi obstajal.;Pokopala sem prazno krsto.;Preživela je, a njen obraz bo za vedno ostal iznakažen.
Tako da...;Privolite, ali pa ...;George, poslušaj ...;Vidim.
To je pomembno.;To je drugače.;To je vse.;To moraš storiti.
-Žal mi je, šef.;-Ne bo me tu.;-Žal mi je.;-Ne vem, šef.
Kje so moji prekleti... cigareti?;Kje so moje presnete cigarete?;Kaj, za vraga, se je zgodilo v tistih celicah, Ted?;Moja pištola ... Kaj ste naredili z mojo pištolo?
Tukaj.;Tukaj.;Tukaj je.;Tukaj je.
Vzemi mojega.;Najdi ga in ga ubij.;Povej mi po resnici.;Pozabi jo.
Lahko bi prisegel, da so bili v mojem... suknjiču, ko sem se vkrcal.;Prisežem, da sem jih ob vkrcanju imel v plašču.;Nisem še videl šerifovske značke.;Jaz ... Mogoče sem šel na stranišče.
Vladni uslužbenci, še slepega okradejo.;Vladni uslužbenci te oberejo do kosti.;Govorijo, a nihče jih ne posluša.;Odpeljali me bodo v svetilnik.
Hvala.;Hvala.;Oprostite.;Pozdravljen, šef.
So te pred odhodom poučili o instituciji?;So ti dali kakšne napotke?;Ti je Noyce kaj povedal o razporeditvi?;Kaj se ti je zgodilo?
Vse kar vem je, da je bolnišnica za duševne bolezni.;Ni ga na tem oddelku.;Če ga ni na oddelku A, obstaja le eno mesto, kjer bi lahko bil.;In preden sem postala pacientka, sem tu delala.
Za nore kriminalce.;Za nore kriminalce.;Za nore zločince.;Retardirance, morilce, črnuhe.
Če bi bili samo Ijudje, ki se sprehajajo naokrog, slišijo glasove in se podijo za metulji, potem nas nebi potrebovali.;A bojim se, da ga nimamo.;Verjetneje je, da jih bodo povzročali nam.;Mogoče res ne bi smeli iti ven.
Gremo tja?;Tja smo namenjeni?;Greste kam?;Torej, boste odšli s trajektom?
-Jap.;-Ti.;-Ted.;-Šerif Aule.
Drugi stran otoka je skalnata obala, ki se strmo spušča proti morski gladini.;Druga stran otoka je skalnata vse do vode.;Do kopnega je dobrih 17 km in voda je ledeno mrzla.;Edina pot z otoka je trajekt in oni ga nadzorujejo.
Pomol.;Nevihta.;Šerif.;Šerif.
Je edina pot na ali z otoka.;Dok je edini možni vhod in izhod.;Do kopnega je dobrih 17 km in voda je ledeno mrzla.;Druga stran otoka je skalnata vse do vode.
Izpluli bomo takoj, ko se vidva izkrcata.;Izpluli bomo takoj, ko bosta na obali.;Odšla bova z jutranjim trajektom.;Odpeljal vaju bom v Ashecliffe.
Hvaležen bi vama bil, če bosta pohitela.;Prosil bi, da pohitita.;Prosil vaju bom, da odideta v klet.;Pomagali vama bomo, kot bomo največ lahko.
Zakaj?;Zakaj?;Zakaj?;Zakaj?
-Nevihta se bliža.;-Nevihta se bliža.;-To je otok.;-Bojim se, da moram.
"Še nikdar nisem videl značke ""Zvezni policije"".";Nisem še videl šerifovske značke.;Odkar sem na tem otoku nisem spil niti kapljice.;Ja, a videl nisem ničesar.
Sem namestnik upravnika McPherson, gospoda.;Zvezni šerif sem.;Vaši fantje se zdijo nekoliko napeti, g. McPherson.;Oprostite, gospa, ne vem, o čem govorite.
Dobrodošla na Zloveščem otoku.;Dobrodošla na Shutterjev otok.;Lahko se mi pridružita okrog 21h.;Lep večer.
Odpeljal vaju bom do Ashcliffa.;Odpeljal vaju bom v Ashecliffe.;Prosil vaju bom, da odideta v klet.;Odpeljali me bodo v svetilnik.
Vaši fantje delujejo nekoliko napeti, g. McPherson.;Vaši fantje se zdijo nekoliko napeti, g. McPherson.;Dr. Cawley bi rad govoril z vama.;G. Breen, postaviti vam morava nekaj vprašanj, prav?
Trenutno smo vsi.;Šerif, trenutno smo vsi napeti.;Mislim, da jih imajo vsi.;Pravijo, da sem sedaj njihov.
SPOMINJAJTE SE NAS, KER SMO TUDI MI ŽIVELI, SE LJUBILI IN SE SMEJALI.;POKOPALIŠČE BOLNIŠNICE ASHECLIFFE.;ZAKON ŠTIRIH.;ZAKON ŠTIRIH.
Ograja pod visoko napetostjo.;Elektronski varnostni sistem, ograje, zapornice, vrata.;Glasovi in slike prihajajo iz škatle.;-Star svetilnik.
Kako to veš?;Kako veš?;Kaj ne razumeš?;Kaj se ti je zgodilo?
Nekaj podobnega sem že videl.;Ja, a videl nisem ničesar.;Bojim se, da je v drugo smer.;Ta papir bi lahko bil pomemben.
Dobro.;Dobro.;Dobro.;Dobro.
Gospoda, pri vajinem delu vama bomo pomagali, kolikor lahko.;Pomagali vama bomo, kot bomo največ lahko.;Hvala, g. namestnik, to bo vse.;Storili bomo vse, kar bo v naši moči.
Toda med bivanjem tukaj bosta spoštovala protokol.;A upoštevala bosta protokol, sta razumela?;Predati morata svoje orožje.;Spala bosta pri strežnikih.
Se razumemo?;Si poročeni?;Ni tako?;Saj ni zamere, ne?
-Absolutno.;-Popolnoma.;-Ne.;-Ne.
Rdeča opečna zgradba z desne strani je oddelek A, moški zapor.;Oddelek C je stavba na skalovju.;Bila je zaklenjena z zunanje strani in edino okno ima rešetke.;Opečnata stavba na vajini desni je oddelek A, to je moški oddelek.
Oddelek B, ženski oddelek je na vaši levi strani.;Oddelek B je ženski oddelek, to je stavba na vajini levi.;Opečnata stavba na vajini desni je oddelek A, to je moški oddelek.;Oddelek C je stavba na skalovju.
Oddelek C je tista zgradba na pečini.;Oddelek C je stavba na skalovju.;Oddelek B je ženski oddelek, to je stavba na vajini levi.;Dok je edini možni vhod in izhod.
Stara utrdba iz državljanske vojne.;Stara vojaška utrdba.;Bila je zaklenjena z zunanje strani in edino okno ima rešetke.;Oddelek C je stavba na skalovju.
Tam so nastanjeni najnevarnejši pacienti.;Tam so nastanjeni najnevarnejši pacienti.;Včasih so paciente, s kakršnimi delamo tu, vklenili in jih pustili v lastni umazaniji.;To je dokaz obstoja 67. pacienta, za katerega pravijo, da ne obstaja.
Pristop do oddelka C je prepovedan brez pisne odobritve... in fizične prisotnosti tako mene kot dr. Cawleya.;Brez soglasja ter prisotnosti dr. Cawleyja in mene tja ne smeta.;Zato ponovno vztrajam, da morajo biti vsi pacienti iz oddelka C privezani.;Potrebovala bova kartoteko dr. Sheehana in ostalega osebja.
Je to jasno?;Je to jasno?;Jasno?;Razumeš?
Obnašate se, kot da je norost nalezljiva.;Vedete se, kot da je norost nalezljiva.;Pametnejši ste kot izgledate.;A ste nasilni, izurjeni in nevarni.
Tukaj se od vas zahteva, da predata svoje orožje.;Predati morata svoje orožje.;Cawley misli, da ste neškodljivi in vodljivi, a jaz vem, da ni tako.;In vi, vi ste ranjeni, šerif.
G. McPherson, midva... midva sva imenovana pristojna Zvezna policista.;G. McPherson, zvezna šerifa sva.;Sestavila bova poročilo in ga predala ... Hooverjevim fantom.;Cawley misli, da ste neškodljivi in vodljivi, a jaz vem, da ni tako.
Od naju se zahteva, da imava stalno pri sebi svoje orožje.;Orožje morava nositi ves čas.;Cawley misli, da ste neškodljivi in vodljivi, a jaz vem, da ni tako.;To bova morala obdržati.
Izvršna odredba št. 319 Zveznega zakona o državnih kaznilnicah pravi, da ko se nahajate v območju kaznilnice... imajo organi te institucije izvršno oblast.;Izvršna odredba 319 Zveznega zaporniškega zakonika določa, da ima znotraj zapora glavno besedo njegov upravnik.;To je upravnik.;Če vas takoj ne spravimo k razumu, bodo uvedeni dokončni ukrepi, ki bodo zagotavljali, da nikoli več ne boste mogli nikogar poškodovati.
Gospoda, skozi ta vrata ne bosta prišla s svojima pištolama.;Gospoda, z orožjem ne bosta šla skozi ta vrata.;Ti norci vaju lahko ubijejo.;Prosil vaju bom, da odideta v klet.
Dobro.;Dobro.;Dobro.;Dobro.
Zdaj ko smo opravili uradni del, pridita fanta.;Vrnil se bom po vas.;Šerif, trenutno smo vsi napeti.;Pojdimo, fantje!
Kaj pravita, če bi poiskali dr. Cawleya?;Kaj nama lahko poveste o Rachel?;Vesta, kakšno je današnje stanje na področju mentalnega zdravja?;Je bil dr. Sheehan tistega večera prisoten?
Kdaj je torej pobegnila?;Kdaj je ta zapornica pobegnila?;Ali kdo tu ve, kaj je počela pred tem?;Kje je dokaz, da je sploh obstajala?
Ta zapornica?;V tej soseski?;Čisto nič?;Tukaj?
Bojim se, da vaju bo moral z vsem seznaniti dr. Cawley.;Žal vas bo s situacijo moral seznaniti dr. Cawley.;Mislim, da boste to morali vprašati njega.;Govoriti bova morala z dr. Sheehanom.
Protokol.;Protokol.;Šerif.;Šerif.
Zaporniški čuvaj v umobolnici.;V umobolnici je.;Ta grdi pesjan.;Zvezni šerif je.
Brez zamere a to se sliši zelo nenavadno.;Zdi se, da bi to človek sem in tja opazil.;Res ni ravno podobno legendarnemu Teddyju Danielsu.;To lahko rečejo čisto za vsakogar.
To je edina ustanova te vrste v ZDA.;To je edina ustanova te vrste v ZDA, celo v svetu.;Tam so nastanjeni najnevarnejši pacienti.;To je dokaz obstoja 67. pacienta, za katerega pravijo, da ne obstaja.
Celo na svetu.;Samo en kraj je, kjer ga nihče ne bi opazil.;In prav tako je on.;Kamorkoli, samo ne v umobolnico.
Sprejemamo samo najnevarnejše motene paciente.;"Sprejemamo le najnevarnejše bolnike; take, ki jih ostale bolnice ne morejo.";Tam so nastanjeni najnevarnejši pacienti.;Zato ponovno vztrajam, da morajo biti vsi pacienti iz oddelka C privezani.
Tiste, ki jih druge bolnice ne morejo obvladovati.;Take, ki se jih celo ostali zaporniki bojijo.;"Sprejemamo le najnevarnejše bolnike; take, ki jih ostale bolnice ne morejo.";Če ga ni na oddelku A, obstaja le eno mesto, kjer bi lahko bil.
In vse to je zasluga Dr. Cawleya.;Vse to zaradi dr. Cawleyja.;Tu je ustvaril nekaj edinstvenega.;Samo en kraj je, kjer ga nihče ne bi opazil.
On je tukaj ustvaril res nekaj edinstvenega.;Tu je ustvaril nekaj edinstvenega.;Tu sem zgradil nekaj dragocenega.;To je kafkovska genialnost tega.
To je bolnica za Ijudi, s katerimi naša družba običajno ne želi... ...verjetno tako kot Josh Hopkins, Ben Habbit...;Ustvarjajo prikazni, ki bi jih poslali v svet in počeli stvari, ki jih razumni ljudje nikoli ne bi ... Da bi pridobili take zmožnosti in taka znanja, bi trajalo leta ...;Prosim ... Moj bog ... Ustavi me, preden jih ubijem še več.;Visoko razvite in izmišljene zgodbe ga odvračajo od soočenja z ... Sit sem teh bedarij.
Dokumente gospoda.;Pokažita značko.;Oprostita mi, gospoda.;Šalite se.
Pokažita svoji znački, gospoda.;Za božjo voljo, Teddy.;Prosil vaju bom, da odideta v klet.;S tabo grem, šef.
Dr. Cawley je bil mnogokrat strokovni svetovalec... za Scotland Yard, MI5, OSS... -Zakaj?;Dr. Cawleyja velikokrat prosijo za mnenje ... Scotland Yard, MI 5, OSS ... -Zakaj?;Se je med sinočnjo terapijo zgodilo kaj, kar je bilo bolj omembe vrednega od ... -Normalnega?;Zakaj bi obveščevalne službe hotele nasvet psihiatra?
-Kako to mislite?;-Mislite, da si to zaslužite?;-Kaj to misliš?;-Mene?
Zakaj preiskovalne agencije potrebujejo strokovno svetovanje psihiatra?;Zakaj bi obveščevalne službe hotele nasvet psihiatra?;Zakaj bi to bilo pomembno?;Obstaja razlog, da o svoji pacientki govorite v pretekliku, doktor?
To boste morali vprašati njega.;Mislim, da boste to morali vprašati njega.;Povejte mi še enkrat o tem partnerju.;Ne skrbite glede njega, prav?
Marshal Daniels.;Sem Lester Sheehan.;Teddy Daniels.;Kearns.
-Doktor.;-Šef!;-Ti.;-Ah, ja, ...
Marshal Aule.;Laeddis.;Laeddis.;Laeddis.
Hvala vam, namestnik upravnika, to bi bilo vse.;Hvala, g. namestnik, to bo vse.;Hvala, šerif.;V zadovoljstvo mi je bilo, gospoda.
Da gospod.;Da, gospod.;Dobro, g. Breen.;-Ja.
Prijetno gospodje.;Zdravo, kolega.;Zdravo, kolega.;Oprostita mi, gospoda.
Veliko je imel za povedati o vas.. McPherson je dober človek.;McPherson je dober človek.;Cawley misli, da ste neškodljivi in vodljivi, a jaz vem, da ni tako.;Ne, dr. Sheehan je dober zdravnik.
Verjame v delo, ki ga opravljamo tukaj.;Verjame v naše delo.;Verjame, da smo mi vsi dostavljavci, mlekarji, poštarji.;Samo drug na drugega se lahko zaneseva.
In kaj naj bi to pravzaprav bilo?;In kaj naj bi to bilo?;Za kaj torej gre tu?;Zakaj pa je to bilo kaj takega?
Moralna združitev zakona in reda s klinično nego.;Moralna fuzija zakona in reda ter kliničnega zdravljenja.;Nagnjena k samomoru.;To je kafkovska genialnost tega.
Oprostite mi doktor... združitev česa s čim?;Oprostite, doktor ... Kaj med čem in čem?;Nisem pristaš zdravil, a v vašem primeru ... Kloro ... prom... kaj?;Ko me je poslala po vodo, vam je nekaj rekla, kajne?
Te slike so precej natančne.;Te slike so precej točne.;Imena so sestavljena iz istih črk.;To ni ravno težko ugotoviti.
Prej so bili te vrste pacienti s katerimi imamo tu opravka... okovani v verigah in puščeni v lastni umazaniji.;Včasih so paciente, s kakršnimi delamo tu, vklenili in jih pustili v lastni umazaniji.;Ker nam je Bog dal nasilje, da se vojskujemo njemu na čast.;Verjetneje je, da jih bodo povzročali nam.
Pretepali so jih.;Vsi so ponoreli.;Našli so naju.;Ko je prišla sem, se je zabodla.
Kot da bi z bičanjem do krvi izgnali psihozo iz njih.;Kot bi se česa bali.;Kot bi mu nekdo glavo napolnil z britvami in jo nato močno stresal.;Kot da bi udarci pomagali.
Privijali smo jim vijake v možgane.;Zato, ja ... Stražarji so se predali, vzeli smo jim puške, jih postrojili.;Rezali mi bodo v možgane.;In mi ... Mi smo delali poskuse na pacientih s Shutterjevega otoka.
Potapljali smo jih v ledeni vodi dokler niso izgubili zavest ali... se celo utopili.;Jim vrtali v glave, jih potapljali v ledeno mrzlo vodo, dokler se niso onesvestili ali celo utonili.;Našli smo jo doli pri svetilniku, kjer je metala žabice.;Tiščala jim je glavo pod vodo, dokler niso utonili.
Kaj pa zdaj?;Kaj pa to?;Kaj pa mož?;Kaj je narobe, šef?
-Zdravimo jih.;-Zdravimo jih, poskušamo jih pozdraviti.;-Pregnale bodo bolečino.;-Torej streljajte.
Poskušamo jih pozdraviti.;Če to ne deluje, jih lahko nudimo vsaj določeno mero tolažbe in miru.;Poskusite.;-Zdravimo jih, poskušamo jih pozdraviti.
In če to spodleti, jim vsaj nudimo... določeno mero udobja v njihovem življenju Miru.;Če to ne deluje, jih lahko nudimo vsaj določeno mero tolažbe in miru.;A bojim se, da ga nimamo.;In, kako ji že rečejo ...
To so vsi nasilni prestopniki, drži?;Vsi tu so nasilni prestopniki, kajne?;Kdo je že tukaj glavni, a?!;Ko smo dobili ta primer, sem ga posebej zahteval, razumeš?
Poškodovali so Ijudi.;Ranili so ljudi, nekateri so tudi koga ubili.;Vojake so spreminjali v izdajalce.;Nacisti so uporabili Žide, Sovieti zapornike v svojih gulagih.
Jih umorili v nekaterih primerih.;Zapliniti bi jih morali.;Jaz sem jih ubil, ker ji nisem poiskal pomoči.;Jaz sem jih ubil.
-V skoraj vseh primerih, da.;-Večina njih, da.;-Tudi.;-Zelo verjetno.
Potem pa osebno doktor, bom rekel takole: Jebeš njihov občutek miru.;Doktor, potem bom pa rekel - klinc pa njihov mir.;Dajte no, doktor, niti 10 metrov ne bi prehodila po tem terenu.;Prosim ... Moj bog ... Ustavi me, preden jih ubijem še več.
Moje delo je, da zdravim svoje paciente, ne njihovih žrtev.;Zdravim paciente, ne njihove žrtve.;Imam to radikalno idejo, da če si do pacienta spoštljiv, ga poslušaš in ga poskušaš razumeti, se mu boš morda približal.;Odboru nadzornikov sem prisegel, da lahko ustvarim najbolj radikalno in vrhunsko igro vlog v zgodovine psihiatrije, in da vas bo ta ozdravila.
Nisem tu, da bi jim sodil.;Tu nisem, da bi sodil.;Tu nisem, da bi ubijal.;Tu nisem, da bi ubil Leaddisa.
Torej ta... ženska zapornica... -Pacientka.;Torej, ta zapornica ... -Pacientka.;Nevarna zapornica ... -Pacientka.;-Ljubi bog, jaz ... -Brez skrbi.
Oprostite mi, pacientka.;Oprostite, gospa, ne vem, o čem govorite.;Narobe ste me razumeli.;Prosim, prenehaj govoriti.
Neka... Rachel Solando, Je pobegnila enkrat v zadnjih štiriindvajsetih urah.;Oprostite, pacientka ... Rachel Solando je pobegnila v zadnjih 24 urah.;Prosim ... Moj bog ... Ustavi me, preden jih ubijem še več.;Pozabil sem, da odhajate, sedaj ko smo Rachel našli.
Včeraj zvečer med 22.00h in 24.00h.;Sinoči, med 22. uro in polnočjo.;Za nocoj bomo zaključili.;Lahko se mi pridružita okrog 21h.
Ali se smatra za nevarno?;Je to jasno?;Jasno?;Je postala nevidna?
-Lahko bi tako rekli.;-Lahko bi tako rekli.;-Bilo je očitno.;-Sploh ni domneva.
Ubila je vse tri svoje otroke.;Umorila je svoje tri otroke.;Umorila je najine otroke.;Vztrajala je, da otroci niso mrtvi.
